imdbID,Actors,Awards,BoxOffice,Country,Director,Genre,Language,Production,Rated,Released,Runtime,Title,Year,imdbRating,imdbVotes,Opening Weekend USA,budget,critic number,user review number
tt0450259,"Leonardo DiCaprio, Djimon Hounsou, Jennifer Connelly, Kagiso Kuypers",Nominated for 5 Oscars. Another 8 wins & 26 nominations.,"$57,300,000","Germany, USA",Edward Zwick,"Adventure, Drama, Thriller","English, Mende, Afrikaans",Warner Bros. Pictures,R,08 Dec 2006,143 min,Blood Diamond,2006.0,8.0,"440,219",8648324.0,100000000,169.0,677.0
tt0436697,"Helen Mirren, James Cromwell, Alex Jennings, Roger Allam",Won 1 Oscar. Another 94 wins & 95 nominations.,"$56,222,759","UK, USA, France, Italy",Stephen Frears,"Biography, Drama","English, German, French",Miramax Films,PG-13,17 Nov 2006,103 min,The Queen,2006.0,7.3,"94,039",122014.0,9800000,280.0,434.0
tt0406816,"Kevin Costner, Ashton Kutcher, Sela Ward, Melissa Sagemiller",1 win & 4 nominations.,"$54,983,983",USA,Andrew Davis,"Action, Adventure, Drama",English,Buena Vista Pictures,PG-13,29 Sep 2006,139 min,The Guardian,2006.0,6.9,"80,091",18006064.0,70000000,138.0,281.0
tt0466909,"Predrag Bjelac, Carlo Sabatini, Bohumil Svarc, Liev Schreiber",1 win & 6 nominations.,"$54,600,000",USA,John Moore,Horror,"English, Italian",20th Century Fox,R,06 Jun 2006,110 min,The Omen,2006.0,5.5,"51,628",16026496.0,25000000,229.0,549.0
tt0414982,"Mary Elizabeth Winstead, Ryan Merriman, Kris Lemche, Alexz Johnson",6 nominations.,"$54,100,000","Germany, USA, Canada",James Wong,"Fantasy, Horror, Mystery",English,New Line Cinema,R,10 Feb 2006,93 min,Final Destination 3,2006.0,5.8,"113,500",19173094.0,25000000,216.0,575.0
tt0482571,"Hugh Jackman, Christian Bale, Michael Caine, Piper Perabo",Nominated for 2 Oscars. Another 5 wins & 37 nominations.,"$53,100,000","USA, UK",Christopher Nolan,"Drama, Mystery, Sci-Fi",English,Buena Vista Pictures,PG-13,20 Oct 2006,130 min,The Prestige,2006.0,8.5,"981,296",14801808.0,40000000,357.0,1166.0
tt0410297,"Keanu Reeves, Sandra Bullock, Christopher Plummer, Ebon Moss-Bachrach",2 wins & 2 nominations.,"$52,300,000",USA,Alejandro Agresti,"Drama, Fantasy, Romance",English,Warner Bros. Pictures,PG,16 Jun 2006,99 min,The Lake House,2006.0,6.8,"123,858",13616196.0,40000000,176.0,554.0
tt0472043,"Rudy Youngblood, Dalia Hernández, Jonathan Brewer, Morris Birdyellowhead",Nominated for 3 Oscars. Another 9 wins & 20 nominations.,"$50,772,724",USA,Mel Gibson,"Action, Adventure, Drama",Maya,Buena Vista,R,08 Dec 2006,139 min,Apocalypto,2006.0,7.8,"258,090",15005604.0,40000000,287.0,1070.0
tt0408345,"Harrison Ford, Virginia Madsen, Carly Schroeder, Jimmy Bennett",3 nominations.,"$48,699,400",USA,Richard Loncraine,"Crime, Thriller",English,Warner Bros.,PG-13,10 Feb 2006,105 min,Firewall,2006.0,5.8,"52,301",13635463.0,50000000,172.0,308.0
tt0466342,"Alyson Hannigan, Adam Campbell, Sophie Monk, Eddie Griffin",4 wins & 1 nomination.,"$48,478,234","USA, Switzerland","Aaron Seltzer, Jason Friedberg(co-director)","Comedy, Romance",English,20th Century Fox,PG-13,17 Feb 2006,83 min,Date Movie,2006.0,2.8,"52,765",21812384.0,20000000,99.0,612.0
tt0455857,"Camilla Belle, Tommy Flanagan, Katie Cassidy, Tessa Thompson",3 nominations.,"$47,860,214",USA,Simon West,"Crime, Horror, Mystery",English,Screen Gems,PG-13,03 Feb 2006,87 min,When a Stranger Calls,2006.0,5.1,"38,082",21607203.0,15000000,154.0,475.0
tt0384537,"Radha Mitchell, Sean Bean, Laurie Holden, Deborah Kara Unger",8 nominations.,"$46,982,632","Canada, France, Japan, USA",Christophe Gans,Horror,English,Sony Pictures,R,21 Apr 2006,125 min,Silent Hill,2006.0,6.6,"194,315",,,272.0,1763.0
tt0758794,"Matthew McConaughey, Matthew Fox, Anthony Mackie, David Strathairn",1 nomination.,"$43,532,294",USA,McG,"Drama, Sport",English,Warner Bros. Pictures,PG,22 Dec 2006,131 min,We Are Marshall,2006.0,7.1,"51,084",8582508.0,65000000,86.0,180.0
tt0452637,"Paul Giamatti, Bryce Dallas Howard, Jeffrey Wright, Bob Balaban",10 wins & 10 nominations.,"$42,219,433",USA,M. Night Shyamalan,"Drama, Fantasy, Mystery",English,Warner Bros. Pictures,PG-13,21 Jul 2006,110 min,Lady in the Water,2006.0,5.6,"85,669",18044396.0,70000000,286.0,1040.0
tt0454841,"Maxime Giffard, Michael Bailey Smith, Tom Bower, Ted Levine",2 wins & 7 nominations.,"$41,685,824",USA,Alexandre Aja,"Horror, Thriller",English,Fox Searchlight Pictures,R,10 Mar 2006,107 min,The Hills Have Eyes,2006.0,6.4,"142,873",15708512.0,15000000,269.0,866.0
tt0455967,"Jesse Metcalfe, Brittany Snow, Ashanti, Sophia Bush",2 wins & 2 nominations.,"$40,922,134","USA, Canada",Betty Thomas,"Comedy, Romance","English, Japanese",20th Century Fox,PG-13,28 Jul 2006,89 min,John Tucker Must Die,2006.0,5.8,"72,364",14276534.0,18000000,99.0,168.0
tt0420223,"Will Ferrell, William Dick, Guy Massey, Martha Espinoza",Nominated for 1 Golden Globe. Another 3 wins & 14 nominations.,"$40,137,776",USA,Marc Forster,"Comedy, Drama, Fantasy",English,Sony Pictures,PG-13,10 Nov 2006,113 min,Stranger Than Fiction,2006.0,7.6,"200,123",13411093.0,38000000,254.0,544.0
tt0443543,"Edward Norton, Paul Giamatti, Jessica Biel, Rufus Sewell",Nominated for 1 Oscar. Another 10 wins & 10 nominations.,"$39,680,302","USA, Czech Republic",Neil Burger,"Drama, Mystery, Romance",English,Yari Film Group,PG-13,01 Sep 2006,110 min,The Illusionist,2006.0,7.6,"324,518",927956.0,16000000,235.0,656.0
tt0420294,"Jordana Brewster, Taylor Handley, Diora Baird, Matt Bomer",5 nominations.,"$39,418,953",USA,Jonathan Liebesman,"Horror, Thriller",English,New Line Cinema,R,06 Oct 2006,91 min,The Texas Chainsaw Massacre: The Beginning,2006.0,5.9,"61,460",18508228.0,16000000,198.0,372.0
tt0433386,"Sarah Michelle Gellar, Amber Tamblyn, Arielle Kebbel, Takako Fuji",3 nominations.,"$39,143,839","USA, Japan",Takashi Shimizu,"Horror, Thriller","English, Japanese",Sony Pictures Entertainment,PG-13,13 Oct 2006,102 min,The Grudge 2,2006.0,5.0,"42,223",20825300.0,20000000,130.0,282.0
tt0408985,"Queen Latifah, LL Cool J, Timothy Hutton, Giancarlo Esposito",7 nominations.,"$38,360,195",USA,Wayne Wang,Comedy,"English, French",Paramount Pictures,PG-13,13 Jan 2006,112 min,Last Holiday,2006.0,6.4,"23,946",15508779.0,45000000,98.0,118.0
tt0457430,"Ivana Baquero, Sergi López, Maribel Verdú, Doug Jones",Won 3 Oscars. Another 99 wins & 105 nominations.,"$37,500,000","Spain, Mexico, USA",Guillermo del Toro,"Drama, Fantasy, War",Spanish,Picturehouse,R,19 Jan 2007,118 min,Pan's Labyrinth,2006.0,8.2,"539,148",779427.0,13500000,423.0,1144.0
tt0762121,"Keisha Castle-Hughes, Oscar Isaac, Hiam Abbass, Shaun Toub",3 wins & 3 nominations.,"$37,617,947",USA,Catherine Hardwicke,"Drama, Family, History",English,New Line Cinema,PG,01 Dec 2006,101 min,The Nativity Story,2006.0,6.8,"8,857",7849304.0,30000000,122.0,205.0
tt0483726,"Robin Williams, Christopher Walken, Laura Linney, Lewis Black",1 nomination.,"$37,442,180",USA,Barry Levinson,"Comedy, Drama, Romance",English,Universal Pictures,PG-13,13 Oct 2006,115 min,Man of the Year,2006.0,6.2,"29,420",12299380.0,20000000,112.0,239.0
tt0405469,"Kiefer Sutherland, Jim Belushi, Eddie Izzard, Janeane Garofalo",2 nominations.,"$37,310,059","Canada, USA",Steve 'Spaz' Williams,"Animation, Adventure, Comedy",English,Buena Vista,G,14 Apr 2006,82 min,The Wild,2006.0,5.3,"20,806",9684809.0,80000000,102.0,161.0
tt0450232,"Bruce Willis, Yasiin Bey, David Morse, Jenna Stern",2 nominations.,"$36,900,000","USA, Germany",Richard Donner,"Action, Crime, Drama","English, Spanish",Warner Bros.,PG-13,03 Mar 2006,102 min,16 Blocks,2006.0,6.6,"118,175",11855260.0,52000000,201.0,306.0
tt0384793,"Justin Long, Jonah Hill, Adam Herschman, Columbus Short",4 nominations.,"$36,300,285",USA,Steve Pink,Comedy,English,Universal Pictures,PG-13,18 Aug 2006,93 min,Accepted,2006.0,6.5,"112,226",10023835.0,23000000,115.0,213.0
tt0443632,"Michael Douglas, Kiefer Sutherland, Eva Longoria, Martin Donovan",2 nominations.,"$36,226,144",USA,Clark Johnson,"Action, Crime, Thriller",English,20th Century Fox,PG-13,21 Apr 2006,108 min,The Sentinel,2006.0,6.1,"44,483",14367854.0,60000000,161.0,217.0
tt0475394,"Ryan Reynolds, Ray Liotta, Joseph Ruskin, Alex Rocco",4 wins.,"$35,600,000","UK, France, USA",Joe Carnahan,"Action, Crime, Drama",English,Universal Pictures,R,26 Jan 2007,108 min,Smokin' Aces,2006.0,6.7,"127,273",14638755.0,17000000,187.0,481.0
tt0206634,"Clive Owen, Juan Gabriel Yacuzzi, Michael Caine, Mishal Husain",Nominated for 3 Oscars. Another 48 wins & 76 nominations.,"$35,100,000","USA, UK, Japan",Alfonso Cuarón,"Drama, Sci-Fi, Thriller","English, German, Italian, Romanian, Spanish, Arabic, Georgian, Russian, Serbian",Universal Pictures,R,05 Jan 2007,109 min,Children of Men,2006.0,7.9,"401,484",179268.0,76000000,383.0,1249.0
tt0790604,"Danny DeVito, Matthew Broderick, Kristin Davis, Kristin Chenoweth",1 win & 8 nominations.,"$35,058,863",USA,John Whitesell,"Comedy, Family",English,20th Century Fox,PG,22 Nov 2006,93 min,Deck the Halls,2006.0,4.9,"18,866",12001256.0,,72.0,114.0
tt0446046,"Antonio Banderas, Rob Brown, Yaya DaCosta, Alfre Woodard",1 win & 6 nominations.,"$34,703,228",USA,Liz Friedlander,"Drama, Music",English,New Line Cinema,PG-13,07 Apr 2006,118 min,Take the Lead,2006.0,6.7,"23,096",12051277.0,30000000,101.0,128.0
tt0449467,"Brad Pitt, Cate Blanchett, Mohamed Akhzam, Peter Wight",Won 1 Oscar. Another 41 wins & 134 nominations.,"$34,237,104","France, USA, Mexico",Alejandro G. Iñárritu,Drama,"English, Arabic, Spanish, Japanese, Berber languages, French, Russian, Japanese Sign Language",Paramount Classics,R,10 Nov 2006,143 min,Babel,2006.0,7.5,"262,601",389351.0,25000000,250.0,926.0
tt0417148,"Samuel L. Jackson, Julianna Margulies, Nathan Phillips, Rachel Blanchard",3 wins & 7 nominations.,"$33,886,034","Germany, USA, Canada",David R. Ellis,"Action, Adventure, Crime",English,New Line Cinema,R,18 Aug 2006,105 min,Snakes on a Plane,2006.0,5.5,"122,026",15206301.0,33000000,283.0,1039.0
tt0418689,"Ryan Phillippe, Jesse Bradford, Adam Beach, John Benjamin Hickey",Nominated for 2 Oscars. Another 15 wins & 24 nominations.,"$33,600,000",USA,Clint Eastwood,"Drama, History, War",English,Paramount,R,20 Oct 2006,135 min,Flags of our Fathers,2006.0,7.1,"107,931",10245190.0,90000000,281.0,422.0
tt0475276,"J.J. Johnson, Gary Commock, Polly Adams, Opal Alladin",Nominated for 2 Oscars. Another 28 wins & 54 nominations.,"$31,500,000","USA, UK, France",Paul Greengrass,"Drama, History, Thriller","English, Arabic, German",Universal Pictures,R,28 Apr 2006,111 min,United 93,2006.0,7.6,"89,167",,,283.0,832.0
tt0424993,"Dane Cook, Jessica Simpson, Dax Shepard, Andy Dick",2 nominations.,"$28,364,748",USA,Greg Coolidge,"Comedy, Romance",English,Lionsgate,PG-13,06 Oct 2006,103 min,Employee of the Month,2006.0,5.5,"39,952",11407751.0,12000000,85.0,152.0
tt0455499,"Breckin Meyer, Jennifer Love Hewitt, Billy Connolly, Bill Murray",4 nominations.,"$28,280,486","UK, USA",Tim Hill,"Animation, Comedy, Family",English,20th Century Fox,PG,16 Jun 2006,82 min,Garfield 2,2006.0,5.0,"31,607",7288977.0,60000000,77.0,79.0
tt0429589,"Julia Roberts, Nicolas Cage, Meryl Streep, Paul Giamatti",1 win & 4 nominations.,"$28,100,000",USA,John A. Davis,"Animation, Adventure, Comedy",English,Warner Bros. Pictures,PG,28 Jul 2006,88 min,The Ant Bully,2006.0,5.9,"32,627",8432465.0,50000000,105.0,72.0
tt0479884,"Jason Statham, Amy Smart, Jose Pablo Cantillo, Efren Ramirez",2 wins & 2 nominations.,"$27,800,000",USA,"Mark Neveldine, Brian Taylor","Action, Crime, Thriller","English, Spanish, Korean",Lionsgate,R,01 Sep 2006,88 min,Crank,2006.0,7.0,"212,197",12896635.0,12000000,169.0,449.0
tt0446059,"Jet Li, Li Sun, Yong Dong, Yun Qu",5 wins & 12 nominations.,"$24,571,445","China, Hong Kong",Ronny Yu,"Action, Biography, Drama","Mandarin, English, Japanese",Rogue Pictures (Focus),PG-13,22 Sep 2006,104 min,Fearless,2006.0,7.7,"66,650",10590244.0,,147.0,208.0
tt0424345,"Brian O'Halloran, Jeff Anderson, Jason Mewes, Kevin Smith",3 wins & 3 nominations.,"$23,951,963",USA,Kevin Smith,Comedy,English,MGM,R,21 Jul 2006,97 min,Clerks II,2006.0,7.4,"120,781",10061132.0,5000000,172.0,471.0
tt0465624,"Uma Thurman, Luke Wilson, Anna Faris, Rainn Wilson",1 win & 1 nomination.,"$22,432,518",USA,Ivan Reitman,"Comedy, Romance, Sci-Fi",English,20th Century Fox,PG-13,21 Jul 2006,96 min,My Super Ex-Girlfriend,2006.0,5.1,"57,110",8603460.0,30000000,145.0,201.0
tt0387877,"Josh Hartnett, Scarlett Johansson, Aaron Eckhart, Hilary Swank",Nominated for 1 Oscar. Another 4 wins & 12 nominations.,"$22,518,325","Germany, USA, France",Brian De Palma,"Crime, Drama, Mystery","English, German",Universal Pictures,R,15 Sep 2006,121 min,The Black Dahlia,2006.0,5.6,"66,373",10005895.0,50000000,239.0,652.0
tt0456020,"Tyrese Gibson, Shawn Parr, Henry Hunter Hall, Johnny C. Pruitt",4 nominations.,"$21,318,194",USA,Vondie Curtis-Hall,"Action, Crime, Drama",English,Focus Features,R,23 Jun 2006,97 min,Waist Deep,2006.0,5.9,"8,689",9404180.0,,41.0,49.0
tt0454776,"Ioan Gruffudd, Romola Garai, Benedict Cumberbatch, Albert Finney",1 win & 6 nominations.,"$21,156,133","USA, UK",Michael Apted,"Biography, Drama, History",English,Samuel Goldwyn Films LLC,PG,23 Feb 2007,118 min,Amazing Grace,2006.0,7.5,"22,148",4054542.0,,96.0,153.0
tt0466856,"Greg Andrews, Monica, Brandon Bernard Benton, Adam Boyer",7 nominations.,"$21,160,089",USA,Chris Robinson,"Comedy, Crime, Drama",English,Warner Bros.,PG-13,31 Mar 2006,105 min,ATL,2006.0,6.0,"9,035",11554404.0,,52.0,94.0
tt0434215,"Tim McGraw, Maria Bello, Alison Lohman, Ryan Kwanten",3 nominations.,"$20,949,649","USA, UK",Michael Mayer,"Adventure, Drama, Family",English,20th Century Fox,PG,20 Oct 2006,95 min,Flicka,2006.0,6.2,"6,639",7703551.0,15000000,45.0,77.0
tt0454919,"Kristen Bell, Ian Somerhalder, Christina Milian, Rick Gonzalez",1 nomination.,"$20,230,986",USA,Jim Sonzero,"Horror, Sci-Fi, Thriller",English,The Weinstein Company,PG-13,11 Aug 2006,90 min,Pulse,2006.0,4.7,"26,267",8203822.0,20000000,150.0,257.0
tt0486551,"M.C. Gainey, Paul Soter, Erik Stolhanske, Cloris Leachman",1 win & 3 nominations.,"$19,037,418",USA,Jay Chandrasekhar,Comedy,"English, German",Warner Bros. Pictures,R,25 Aug 2006,110 min,Beerfest,2006.0,6.3,"57,627",7031228.0,17500000,88.0,175.0
tt0437800,"Keke Palmer, Laurence Fishburne, Angela Bassett, Curtis Armstrong",12 wins & 14 nominations.,"$18,811,135",USA,Doug Atchison,Drama,English,Lionsgate Releasing,PG,28 Apr 2006,112 min,Akeelah and the Bee,2006.0,7.4,"16,498",6011585.0,,94.0,173.0
tt0429591,"Emma Roberts, Joanna 'JoJo' Levesque, Sara Paxton, Jake McDorman",1 win & 5 nominations.,"$18,562,160",USA,Elizabeth Allen Rosenbaum,"Comedy, Family, Fantasy",English,20th Century Fox,PG,03 Mar 2006,104 min,Aquamarine,2006.0,5.3,"33,714",7482669.0,12000000,67.0,148.0
tt0370032,"Milla Jovovich, Cameron Bright, Nick Chinlund, Sebastien Andrieu",1 win & 2 nominations.,"$18,337,122",USA,Kurt Wimmer,"Action, Sci-Fi, Thriller","English, Vietnamese",Sony Pictures,PG-13,03 Mar 2006,88 min,Ultraviolet,2006.0,4.4,"74,401",9064880.0,30000000,158.0,835.0
tt0462519,"Billy Bob Thornton, Jon Heder, Jacinda Barrett, Michael Clarke Duncan",2 nominations.,"$17,787,157",USA,Todd Phillips,Comedy,English,MGM,PG-13,29 Sep 2006,100 min,School for Scoundrels,2006.0,5.9,"27,422",8602333.0,20000000,107.0,102.0
tt0455590,"Forest Whitaker, James McAvoy, Kerry Washington, Gillian Anderson",Won 1 Oscar. Another 47 wins & 31 nominations.,"$17,449,410","UK, Germany",Kevin Macdonald,"Biography, Drama, History","English, French, German, Swahili",Fox Searchlight,R,19 Jan 2007,123 min,The Last King of Scotland,2006.0,7.7,"158,397",142899.0,6000000,254.0,358.0
tt0465551,"Judi Dench, Cate Blanchett, Tom Georgeson, Michael Maloney",Nominated for 4 Oscars. Another 15 wins & 68 nominations.,"$17,400,000",UK,Richard Eyre,"Crime, Drama, Romance","English, French",Fox Searchlight Pictures,R,26 Jan 2007,92 min,Notes on a Scandal,2006.0,7.4,"68,459",5090.0,15000000,219.0,286.0
tt0397078,"Lindsay Lohan, Chris Pine, Samaire Armstrong, Bree Turner",7 nominations.,"$17,229,124",USA,Donald Petrie,"Comedy, Fantasy, Romance",English,20th Century Fox,PG-13,12 May 2006,103 min,Just My Luck,2006.0,5.4,"48,415",5692285.0,28000000,99.0,149.0
tt0488658,"Lewis Black, Wilmer Valderrama, Tyler James Williams, Dyllan Christopher",1 win & 3 nominations.,"$16,614,132",USA,Paul Feig,"Adventure, Comedy, Family","English, Spanish",Warner Bros.,PG,08 Dec 2006,90 min,Unaccompanied Minors,2006.0,5.1,"9,192",5815474.0,26000000,74.0,58.0
tt0422720,"Kirsten Dunst, Jason Schwartzman, Judy Davis, Rip Torn",Won 1 Oscar. Another 18 wins & 23 nominations.,"$15,962,471","USA, France, Japan",Sofia Coppola,"Biography, Drama, History","English, Latin, French",Sony Pictures,PG-13,20 Oct 2006,123 min,Marie Antoinette,2006.0,6.4,"88,403",5361050.0,40000000,266.0,635.0
tt0462395,"Larry the Cable Guy, David Koechner, Michael Papajohn, Phyllis Alexion",3 nominations.,"$15,655,665",USA,Trent Cooper,"Comedy, Romance",English,Lions Gate Films,PG-13,24 Mar 2006,89 min,Larry the Cable Guy: Health Inspector,2006.0,3.2,"9,327",6922767.0,4000000,36.0,115.0
tt0308353,"George Carlin, John DiMaggio, Andy Dick, Sarah Michelle Gellar",1 nomination.,"$151,873,410","USA, Germany","Paul Bolger, Yvette Kaplan, Greg Tiernan, Dino Athanassiou","Animation, Adventure, Comedy",English,Lionsgate,PG,05 Jan 2007,87 min,Happily N'Ever After,2006.0,4.5,"9,168",6608244.0,47000000,93.0,73.0
tt0426883,"Bruce Willis, Matthew Barry, Emile Hirsch, Fernando Vargas",1 win & 3 nominations.,"$15,133,185","Germany, USA",Nick Cassavetes,"Biography, Crime, Drama",English,Universal Studios,R,12 Jan 2007,122 min,Alpha Dog,2006.0,6.9,"92,758",7411750.0,,100.0,267.0
tt0344854,"Freddie Highmore, Mia Farrow, Ron Crawford, Penny Balfour",1 win & 2 nominations.,"$15,004,318",France,Luc Besson,"Animation, Adventure, Family",English,MGM,PG,12 Jan 2007,94 min,Arthur and the Invisibles,2006.0,6.0,"28,384",5702789.0,86000000,103.0,65.0
tt0427969,"Adrien Brody, Diane Lane, Ben Affleck, Bob Hoskins",Nominated for 1 Golden Globe. Another 3 wins & 7 nominations.,"$14,271,459",USA,Allen Coulter,"Biography, Crime, Drama","English, Spanish",Focus Features,R,08 Sep 2006,126 min,Hollywoodland,2006.0,6.5,"30,566",5926177.0,28000000,217.0,300.0
tt0498380,"Ken Watanabe, Kazunari Ninomiya, Tsuyoshi Ihara, Ryo Kase",Won 1 Oscar. Another 23 wins & 37 nominations.,"$13,600,000",USA,Clint Eastwood,"Drama, History, War","Japanese, English",Warner Bros. Pictures,R,02 Feb 2007,141 min,Letters from Iwo Jima,2006.0,7.9,"141,311",122548.0,19000000,254.0,333.0
tt0430431,"Tiffany Dupont, Luke Goss, John Noble, Omar Sharif",2 wins.,"$13,391,174",USA,Michael O. Sajbel,"Biography, Drama, History",English,Gener8Xion Entertainment,PG,13 Oct 2006,123 min,One Night with the King,2006.0,6.3,"6,144",4106862.0,20000000,36.0,178.0
tt0454824,"James Franco, Scott Hazell, Mac McDonald, Philip Winchester",2 wins & 3 nominations.,"$13,048,522","UK, USA",Tony Bill,"Action, Adventure, Drama","English, French",MGM,PG-13,22 Sep 2006,140 min,Flyboys,2006.0,6.5,"37,918",6004219.0,60000000,121.0,251.0
tt0462346,"Luke Benward, Hallie Kate Eisenberg, Adam Hicks, Austin Rogers",1 win & 2 nominations.,"$13,022,756",USA,Bob Dolman,"Comedy, Family",English,New Line Cinema,PG,25 Aug 2006,84 min,How to Eat Fried Worms,2006.0,5.4,"4,476",4003537.0,,44.0,33.0
tt0441909,"Penélope Cruz, Carmen Maura, Lola Dueñas, Blanca Portillo",Nominated for 1 Oscar. Another 60 wins & 90 nominations.,"$12,830,604",Spain,Pedro Almodóvar,"Comedy, Crime, Drama",Spanish,Sony Pictures Classics,R,26 Jan 2007,121 min,Volver,2006.0,7.6,"83,604",197703.0,7450000,230.0,236.0
tt0417225,"André Benjamin, Big Boi, Paula Patton, Terrence Howard",1 win & 5 nominations.,"$12,549,485",USA,Bryan Barber,"Crime, Drama, Musical",English,Universal Pictures,R,25 Aug 2006,121 min,Idlewild,2006.0,6.2,"4,831",5745780.0,15000000,82.0,93.0
tt0349467,"Samuel L. Jackson, Julianne Moore, Edie Falco, Ron Eldard",2 wins & 3 nominations.,"$12,260,586",USA,Joe Roth,"Crime, Drama, Mystery","English, Italian",Sony Pictures Entertainment,R,17 Feb 2006,113 min,Freedomland,2006.0,5.1,"14,092",6707111.0,37665000,101.0,188.0
tt0383060,"Tim Allen, Courteney Cox, Chevy Chase, Spencer Breslin",4 wins & 8 nominations.,"$11,600,000",USA,Peter Hewitt,"Action, Adventure, Comedy",English,Sony Pictures Entertainment,PG,11 Aug 2006,83 min,Zoom,2006.0,4.3,"16,538",4510408.0,35000000,61.0,113.0
tt0434139,"Zach Braff, Jacinda Barrett, Casey Affleck, Rachel Bilson",1 win & 4 nominations.,"$11,502,628",USA,Tony Goldwyn,"Comedy, Drama, Romance",English,Paramount,R,15 Sep 2006,104 min,The Last Kiss,2006.0,6.5,"39,197",4627989.0,20000000,129.0,161.0
tt0433412,"Hilary Duff, Haylie Duff, Maria Conchita Alonso, Anjelica Huston",1 win & 4 nominations.,"$11,337,251",USA,Martha Coolidge,"Comedy, Family, Romance",English,MGM/UA,PG,18 Aug 2006,98 min,Material Girls,2006.0,3.9,"20,120",4603121.0,,55.0,94.0
tt0437777,"Sanaa Lathan, Fuzzy Fantabulous, Katharine Towne, Stanley DeSantis",4 wins & 10 nominations.,"$11,425,894",USA,Sanaa Hamri,"Comedy, Drama, Romance","English, Spanish",Focus Features,PG-13,03 Feb 2006,99 min,Something New,2006.0,6.8,"11,241",4879736.0,,75.0,141.0
tt0405094,"Martina Gedeck, Ulrich Mühe, Sebastian Koch, Ulrich Tukur",Won 1 Oscar. Another 75 wins & 34 nominations.,"$11,200,000",Germany,Florian Henckel von Donnersmarck,"Drama, Thriller",German,Sony Pictures Classics,R,30 Mar 2007,137 min,The Lives of Others,2006.0,8.4,"301,783",213589.0,2000000,215.0,425.0
tt0308055,"Harry Belafonte, Joy Bryant, Nick Cannon, Emilio Estevez",Nominated for 2 Golden Globes. Another 7 wins & 15 nominations.,"$11,098,707",USA,Emilio Estevez,"Biography, Drama, History","English, Spanish",The Weinstein Co.,R,23 Nov 2006,117 min,Bobby,2006.0,7.0,"39,368",69039.0,14000000,198.0,271.0
tt0457513,"Jim Dunk, Robert Bathurst, Geoff Bell, Christopher Fulford",1 nomination.,"$10,467,056","UK, USA",Woody Allen,"Comedy, Crime, Mystery",English,Focus Features,PG-13,28 Jul 2006,96 min,Scoop,2006.0,6.7,"73,315",3046924.0,4000000,170.0,254.0
tt0414993,"Hugh Jackman, Rachel Weisz, Ellen Burstyn, Mark Margolis",Nominated for 1 Golden Globe. Another 9 wins & 34 nominations.,"$10,046,093","USA, Canada",Darren Aronofsky,"Drama, Sci-Fi","English, Maya",Warner Bros. Pictures,PG-13,22 Nov 2006,96 min,The Fountain,2006.0,7.3,"208,541",3768702.0,35000000,275.0,942.0
tt0462200,"Samuel L. Jackson, Christina Ricci, Justin Timberlake, S. Epatha Merkerson",1 win & 7 nominations.,"$9,262,318",USA,Craig Brewer,"Drama, Music",English,Paramount Vantage,R,02 Mar 2007,116 min,Black Snake Moan,2006.0,7.0,"56,360",4143199.0,15000000,195.0,211.0
tt0433416,"Kal Penn, Tabu, Irrfan Khan, Jacinda Barrett",4 wins & 6 nominations.,"$13,494,515","USA, India",Mira Nair,Drama,"English, Hindi, Bengali, French",Fox Searchlight Pictures,PG-13,06 Apr 2007,122 min,The Namesake,2006.0,7.6,"17,513",248552.0,,165.0,121.0
tt0365830,"Jack Black, Kyle Gass, JR Reed, Ronnie James Dio",2 nominations.,"$8,199,999","USA, Germany",Liam Lynch,"Adventure, Comedy, Music",English,New Line Cinema,R,22 Nov 2006,93 min,Tenacious D in The Pick of Destiny,2006.0,6.8,"92,891",3234879.0,,124.0,204.0
tt0482463,"Eduardo Verástegui, Tammy Blanchard, Manny Perez, Angélica Aragón",6 wins.,"$7,884,317","USA, Mexico",Alejandro Monteverde,"Drama, Romance","English, Spanish",Roadside Attractions,PG-13,30 Nov 2007,91 min,Bella,2006.0,7.3,"9,948",1324000.0,3300000,60.0,175.0
tt0453494,"Luke Wilson, Logan Lerman, Brie Larson, Tim Blake Nelson",1 win & 5 nominations.,"$8,080,116",USA,Wil Shriner,"Adventure, Comedy, Family",English,New Line Cinema,PG,05 May 2006,91 min,Hoot,2006.0,5.6,"7,086",3368197.0,15000000,49.0,68.0
tt0446755,"Catherine An, Bin Li, Bin Wu, Alan David",Won 1 Golden Globe. Another 10 wins & 13 nominations.,"$7,932,205","China, USA, Canada",John Curran,"Drama, Romance","Mandarin, English, French",Warner Independent Pictures,PG-13,19 Jan 2007,125 min,The Painted Veil,2006.0,7.5,"83,194",71814.0,19400000,143.0,229.0
tt0448075,"Robin Williams, Toni Collette, Joe Morton, Bobby Cannavale",2 nominations.,"$7,766,987",USA,Patrick Stettner,"Crime, Mystery, Thriller",English,Miramax,R,04 Aug 2006,91 min,The Night Listener,2006.0,5.9,"13,577",3554134.0,4000000,126.0,160.0
tt0439815,"Don Thompson, Nathan Fillion, Gregg Henry, Xantha Radley",2 wins & 5 nominations.,"$7,774,730","Canada, USA",James Gunn,"Comedy, Horror, Sci-Fi",English,Universal Pictures,R,31 Mar 2006,95 min,Slither,2006.0,6.5,"66,913",3880270.0,15500000,263.0,366.0
tt0401445,"Freddie Highmore, Albert Finney, Russell Crowe, Rafe Spall",1 win & 2 nominations.,"$7,365,004","USA, UK",Ridley Scott,"Comedy, Drama, Romance","English, French, Russian",20th Century Fox,PG-13,10 Nov 2006,117 min,A Good Year,2006.0,7.0,"78,255",3721526.0,35000000,147.0,204.0
tt0763304,"Daniel Tay, Jimmy Fallon, Jon Stewart, Whoopi Goldberg",2 wins & 1 nomination.,"$7,308,609","USA, UK, France","Dave Borthwick, Jean Duval, Frank Passingham","Animation, Adventure, Comedy",English,Weinstein Company,G,24 Feb 2006,78 min,Doogal,2006.0,2.8,"4,075",3605899.0,20000000,30.0,116.0
tt0465142,"Hugh Grant, Dennis Quaid, Mandy Moore, Willem Dafoe",1 nomination.,"$7,156,725",USA,Paul Weitz,"Comedy, Music","English, Mandarin",Universal Pictures,PG-13,21 Apr 2006,107 min,American Dreamz,2006.0,5.5,"23,271",3667420.0,17000000,149.0,219.0
tt0454970,"Josh Duhamel, Melissa George, Olivia Wilde, Desmond Askew",1 win & 1 nomination.,"$6,908,651",USA,John Stockwell,"Horror, Mystery, Thriller","English, Portuguese",Fox Atomic,R,01 Dec 2006,93 min,Turistas,2006.0,5.4,"33,188",3582554.0,10000000,148.0,227.0
tt0470705,"Ashley Judd, Michael Shannon, Harry Connick Jr., Lynn Collins",1 win & 6 nominations.,"$7,006,708","USA, Germany",William Friedkin,"Drama, Horror, Thriller",English,Lionsgate Films,R,25 May 2007,102 min,Bug,2006.0,6.1,"30,013",4015846.0,4000000,215.0,334.0
