imdbID,Actors,Awards,BoxOffice,Country,Director,Genre,Language,Production,Rated,Released,Runtime,Title,Year,imdbRating,imdbVotes,Opening Weekend USA,budget,critic number,user review number
tt0780622,"Jess Weixler, John Hensley, Josh Pais, Hale Appleman",2 wins & 10 nominations.,"$182,599",USA,Mitchell Lichtenstein,"Comedy, Fantasy, Horror",English,Roadside Attractions,R,03 Apr 2008,94 min,Teeth,2007.0,5.4,"37,317",36530.0,,219.0,168.0
tt0857265,"Michael Caine, Jude Law, Harold Pinter",1 win & 5 nominations.,"$205,005","UK, USA",Kenneth Branagh,"Drama, Mystery, Thriller",English,Sony Pictures Classics,R,23 Nov 2007,88 min,Sleuth,2007.0,6.5,"27,866",46265.0,,145.0,122.0
tt0870090,"Douglas Silva, Darlan Cunha, Jonathan Haagensen, Rodrigo dos Santos",5 nominations.,"$242,655",Brazil,Paulo Morelli,"Crime, Drama",Portuguese,Miramax Films,R,31 Aug 2007,106 min,City of Men,2007.0,7.3,"13,999",130579.0,,84.0,30.0
tt0815178,"Uma Thurman, Evan Rachel Wood, Eva Amurri Martino, Gabrielle Brennan",2 wins.,"$166,373",USA,Vadim Perelman,"Drama, Fantasy, Mystery",English,Magnolia Pictures,R,05 Sep 2008,90 min,The Life Before Her Eyes,2007.0,6.4,"12,736",20220.0,8000000,76.0,79.0
tt0962774,"Baard Owe, Espen Skjønberg, Ghita Nørby, Henny Moan",8 wins & 12 nominations.,"$170,980","Norway, Germany, France, Denmark",Bent Hamer,"Comedy, Drama",Norwegian,Sony Pictures Classics,PG-13,26 Dec 2007,90 min,O'Horten,2007.0,6.8,"3,473",33325.0,,86.0,27.0
tt0846040,"Elio Germano, Riccardo Scamarcio, Angela Finocchiaro, Massimo Popolizio",20 wins & 28 nominations.,"$200,000","Italy, France",Daniele Luchetti,"Comedy, Crime, Drama",Italian,ThinkFilm,R,20 Apr 2007,108 min,My Brother Is an Only Child,2007.0,7.1,"5,390",9357.0,5000000,92.0,21.0
tt0481797,"Tim Roth, Alexandra Maria Lara, Bruno Ganz, André Hennicke",1 win & 1 nomination.,"$200,000","USA, Romania, France, Italy, Germany",Francis Ford Coppola,"Drama, Fantasy, Mystery","English, Sanskrit, German, French, Italian, Russian, Romanian, Mandarin, Latin, Armenian",Sony Pictures Classics,R,26 Oct 2007,124 min,Youth Without Youth,2007.0,6.3,"12,068",28550.0,5000000,127.0,89.0
tt0494222,"Loren Taylor, Jemaine Clement, Joel Tobeck, Brian Sergent",6 wins & 4 nominations.,"$200,000",New Zealand,Taika Waititi,"Comedy, Romance",English,Miramax Films,R,30 Aug 2007,88 min,Eagle vs Shark,2007.0,6.8,"18,918",20361.0,,103.0,63.0
tt0399095,"Kevin Kline, Cesar Ramos, Alicja Bachleda, Paulina Gaitan",5 wins & 2 nominations.,"$118,086","Germany, USA",Marco Kreuzpaintner,"Crime, Drama, Thriller","English, Spanish, Polish, Russian",Roadside Attractions,R,18 Oct 2007,120 min,Trade,2007.0,7.4,"15,653",118086.0,12000000,71.0,98.0
tt0893356,"Hugo Armstrong, Rosalind Chao, Stephen Dorff, John Getz",7 wins & 5 nominations.,"$45,543",USA,"Bill Guttentag, Dan Sturman","Biography, History, War","Japanese, Mandarin, English",ThinkFilm,R,03 Jul 2007,88 min,Nanking,2007.0,7.8,"3,130",6316.0,,45.0,37.0
tt0422783,"Clint Jung, Melissa George, Marion Ross, Rebecca De Mornay",1 win & 1 nomination.,"$129,086",USA,Steven Sawalich,"Biography, Comedy, Drama",English,MGM,R,05 Jan 2007,94 min,Music Within,2007.0,7.4,"5,231",52744.0,,30.0,36.0
tt0887732,"Margherita Buy, Antonio Albanese, Giuseppe Battiston, Alba Rohrwacher",6 wins & 35 nominations.,"$100,000","Italy, Switzerland, France",Silvio Soldini,Drama,Italian,Film Movement,UNRATED,11 Jul 2008,118 min,Days and Clouds,2007.0,6.9,"1,375",16707.0,300000,58.0,9.0
tt0227671,"José Zúñiga, Miguel Sandoval, Olivia Hussey, Elpidia Carrillo",1 nomination.,"$73,452",USA,Judy Hecht Dumontet,Comedy,English,Archangel Entertainment,PG-13,14 Oct 2008,98 min,Tortilla Heaven,2007.0,5.5,340,73452.0,,11.0,6.0
tt0783608,"Woody Harrelson, Kristin Scott Thomas, Lauren Bacall, Ned Beatty",1 win.,"$43,189","USA, UK",Paul Schrader,"Crime, Drama, Mystery",English,ThinkFilm,R,10 Aug 2007,108 min,The Walker,2007.0,5.9,"4,818",16525.0,10000000,71.0,55.0
tt0937237,"Izzy Diaz, Rob Devaney, Ty Jones, Anas Wellman",5 wins & 2 nominations.,"$100,000","USA, Canada",Brian De Palma,"Crime, Thriller, War","English, French, Arabic, German",Magnolia Pictures,R,16 Nov 2007,90 min,Redacted,2007.0,6.1,"9,304",25628.0,5000000,132.0,109.0
tt0266543,"Albert Brooks, Ellen DeGeneres, Alexander Gould, Willem Dafoe",Won 1 Oscar. Another 48 wins & 61 nominations.,"$380,529,370",USA,"Andrew Stanton, Lee Unkrich(co-director)","Animation, Adventure, Comedy",English,Walt Disney Pictures,G,30 May 2003,100 min,Finding Nemo,2003.0,8.1,"805,938",70251710.0,94000000,307.0,892.0
tt0167260,"Noel Appleby, Ali Astin, Sean Astin, David Aston",Won 11 Oscars. Another 197 wins & 122 nominations.,"$364,000,000","USA, New Zealand",Peter Jackson,"Adventure, Drama, Fantasy","English, Quenya, Old English, Sindarin",New Line Cinema,PG-13,17 Dec 2003,201 min,The Lord of the Rings: The Return of the King,2003.0,8.9,"1,377,689",72629713.0,94000000,338.0,3316.0
tt0325980,"Johnny Depp, Geoffrey Rush, Orlando Bloom, Keira Knightley",Nominated for 5 Oscars. Another 36 wins & 96 nominations.,"$305,343,252",USA,Gore Verbinski,"Action, Adventure, Fantasy",English,Buena Vista Pictures,PG-13,09 Jul 2003,143 min,Pirates of the Caribbean: The Curse of the Black Pearl,2003.0,8.0,"908,084",46630690.0,140000000,279.0,2152.0
tt0234215,"Ray Anthony, Christine Anu, Andy Arness, Alima Ashton-Sheibu",8 wins & 31 nominations.,"$281,500,000","USA, Australia","Lana Wachowski, Lilly Wachowski","Action, Sci-Fi","English, French",Warner Bros. Pictures,R,15 May 2003,138 min,The Matrix Reloaded,2003.0,7.2,"455,851",91774413.0,150000000,271.0,2789.0
tt0315327,"Jim Carrey, Morgan Freeman, Jennifer Aniston, Philip Baker Hall",7 wins & 8 nominations.,"$242,589,580",USA,Tom Shadyac,"Comedy, Drama, Fantasy","English, Spanish",Universal Pictures,PG-13,23 May 2003,101 min,Bruce Almighty,2003.0,6.7,"328,214",85734045.0,81000000,190.0,613.0
tt0290334,"Patrick Stewart, Hugh Jackman, Ian McKellen, Halle Berry",6 wins & 41 nominations.,"$214,813,155","Canada, USA",Bryan Singer,"Action, Adventure, Fantasy","English, German, Italian, Spanish",20th Century Fox,PG-13,02 May 2003,134 min,X-Men 2,2003.0,7.5,"451,817",85558731.0,110000000,294.0,1074.0
tt0319343,"Will Ferrell, James Caan, Bob Newhart, Edward Asner",2 wins & 7 nominations.,"$173,400,000",USA,Jon Favreau,"Comedy, Family, Fantasy",English,New Line Cinema,PG,07 Nov 2003,97 min,Elf,2003.0,6.9,"172,376",31113501.0,33000000,158.0,421.0
tt0181852,"Arnold Schwarzenegger, Nick Stahl, Claire Danes, Kristanna Loken",3 wins & 21 nominations.,"$150,252,753","USA, Germany, UK",Jonathan Mostow,"Action, Sci-Fi",English,Warner Bros. Pictures,R,02 Jul 2003,109 min,Terminator 3: Rise of the Machines,2003.0,6.3,"332,281",44041440.0,200000000,281.0,1689.0
tt0242653,"Mary Alice, Tanveer K. Atwal, Helmut Bakaitis, Kate Beahan",4 wins & 30 nominations.,"$139,076,032","Australia, USA","Lana Wachowski, Lilly Wachowski","Action, Sci-Fi","English, French",Warner Bros. Pictures,R,05 Nov 2003,129 min,Matrix Revolutions,2003.0,6.7,"394,645",48475154.0,150000000,243.0,2116.0
tt0349205,"Steve Martin, Bonnie Hunt, Piper Perabo, Tom Welling",2 wins & 7 nominations.,"$138,507,634",USA,Shawn Levy,"Comedy, Family",English,20th Century Fox,PG,25 Dec 2003,98 min,Cheaper by the Dozen,2003.0,5.8,"82,913",27557647.0,40000000,106.0,288.0
tt0172156,"Martin Lawrence, Will Smith, Jordi Mollà, Gabrielle Union",5 wins & 13 nominations.,"$138,396,624",USA,Michael Bay,"Action, Comedy, Crime","English, Spanish",Sony Pictures Entertainment,R,18 Jul 2003,147 min,Bad Boys II,2003.0,6.6,"194,523",46522560.0,130000000,95.0,514.0
tt0305224,"Adam Sandler, Jack Nicholson, Marisa Tomei, Luis Guzmán",2 wins & 5 nominations.,"$133,756,285",USA,Peter Segal,Comedy,English,Sony Pictures Entertainment,PG-13,11 Apr 2003,106 min,Anger Management,2003.0,6.2,"183,250",42220847.0,75000000,130.0,480.0
tt0286716,"Eric Bana, Jennifer Connelly, Sam Elliott, Josh Lucas",3 wins & 14 nominations.,"$132,122,995",USA,Ang Lee,"Action, Sci-Fi","English, Spanish",Universal Pictures,PG-13,20 Jun 2003,138 min,Hulk,2003.0,5.7,"229,932",62128420.0,137000000,267.0,1461.0
tt0322259,"Paul Walker, Tyrese Gibson, Eva Mendes, Cole Hauser",4 wins & 13 nominations.,"$127,083,765","USA, Germany",John Singleton,"Action, Crime, Thriller","English, Spanish",Universal Pictures Distributio,PG-13,06 Jun 2003,107 min,2 Fast 2 Furious,2003.0,5.9,"217,645",50472480.0,76000000,154.0,384.0
tt0337741,"Jack Nicholson, Diane Keaton, Keanu Reeves, Frances McDormand",Nominated for 1 Oscar. Another 7 wins & 12 nominations.,"$121,400,000",USA,Nancy Meyers,"Comedy, Drama, Romance","English, French",Sony Pictures,PG-13,12 Dec 2003,128 min,Something's Gotta Give,2003.0,6.7,"98,329",16064723.0,80000000,144.0,406.0
tt0329575,"David McCullough, Jeff Bridges, Paul Vincent O'Connor, Chris Cooper",Nominated for 7 Oscars. Another 6 wins & 37 nominations.,"$120,147,445",USA,Gary Ross,"Drama, History, Sport",English,Universal Pictures,PG-13,25 Jul 2003,140 min,Seabiscuit,2003.0,7.3,"60,866",20854735.0,87000000,173.0,455.0
tt0257076,"Samuel L. Jackson, Colin Farrell, Michelle Rodriguez, LL Cool J",5 wins & 5 nominations.,"$116,643,346",USA,Clark Johnson,"Action, Adventure, Crime","English, Spanish, French",Columbia Pictures,PG-13,08 Aug 2003,117 min,S.W.A.T.,2003.0,6.0,"127,148",37062535.0,80000000,143.0,346.0
tt0325710,"Ken Watanabe, Tom Cruise, William Atherton, Chad Lindberg",Nominated for 4 Oscars. Another 21 wins & 62 nominations.,"$111,000,000","USA, New Zealand, Japan",Edward Zwick,"Action, Drama, History","English, Japanese",Warner Bros. Pictures,R,05 Dec 2003,154 min,The Last Samurai,2003.0,7.7,"348,657",24271354.0,140000000,190.0,953.0
tt0322330,"Jamie Lee Curtis, Lindsay Lohan, Mark Harmon, Harold Gould",Nominated for 1 Golden Globe. Another 5 wins & 10 nominations.,"$110,180,505",USA,Mark Waters,"Comedy, Family, Fantasy","English, Mandarin",Buena Vista Pictures,PG,06 Aug 2003,97 min,Freaky Friday,2003.0,6.2,"108,624",22203007.0,26000000,128.0,281.0
tt0317740,"Mark Wahlberg, Charlize Theron, Donald Sutherland, Jason Statham",8 wins & 7 nominations.,"$105,996,316","USA, France, UK, Italy",F. Gary Gray,"Action, Crime, Thriller","English, Russian, Italian",Paramount Pictures,PG-13,30 May 2003,111 min,The Italian Job,2003.0,7.0,"309,681",19457944.0,60000000,158.0,499.0
tt0251127,"Kate Hudson, Matthew McConaughey, Kathryn Hahn, Annie Parisse",1 win & 8 nominations.,"$105,765,605","USA, Germany",Donald Petrie,"Comedy, Romance",English,Paramount Pictures,PG-13,07 Feb 2003,116 min,How to Lose a Guy in 10 Days,2003.0,6.4,"176,110",23774850.0,50000000,131.0,362.0
tt0328828,"Jason Biggs, Seann William Scott, Alyson Hannigan, Eddie Kaye Thomas",3 wins & 6 nominations.,"$104,354,205","USA, Germany",Jesse Dylan,Comedy,English,Universal Pictures,R,01 Aug 2003,96 min,American Wedding,2003.0,6.3,"174,949",33369440.0,55000000,151.0,334.0
tt0317303,"Eddie Murphy, Jeff Garlin, Steve Zahn, Regina King",1 win & 6 nominations.,"$103,600,000",USA,Steve Carr,"Comedy, Family","English, Klingon, German",Sony Pictures,PG,09 May 2003,92 min,Daddy Day Care,2003.0,5.5,"54,672",27623580.0,60000000,82.0,118.0
tt0287978,"Ben Affleck, Jennifer Garner, Colin Farrell, Michael Clarke Duncan",5 wins & 16 nominations.,"$102,469,640",USA,Mark Steven Johnson,"Action, Crime, Sci-Fi","English, Greek, Italian",20th Century Fox,PG-13,14 Feb 2003,103 min,Daredevil,2003.0,5.3,"188,950",45033454.0,78000000,278.0,1052.0
tt0312528,"Mike Myers, Alec Baldwin, Kelly Preston, Dakota Fanning",7 wins & 20 nominations.,"$100,446,895",USA,Bo Welch,"Adventure, Comedy, Family",English,Universal Pictures,PG,21 Nov 2003,82 min,The Cat in the Hat,2003.0,3.8,"40,682",38329160.0,109000000,111.0,487.0
tt0305357,"Cameron Diaz, Drew Barrymore, Lucy Liu, Bernie Mac",9 wins & 20 nominations.,"$100,685,880",USA,McG,"Action, Adventure, Comedy","English, Mandarin, Spanish",Columbia Pictures,PG-13,27 Jun 2003,106 min,Charlie's Angels: Full Throttle,2003.0,4.8,"107,752",37634221.0,120000000,103.0,560.0
tt0311113,"Russell Crowe, Paul Bettany, James D'Arcy, Edward Woodall",Won 2 Oscars. Another 21 wins & 90 nominations.,"$92,100,000",USA,Peter Weir,"Action, Adventure, Drama","English, French, Portuguese",20th Century Fox,PG-13,14 Nov 2003,138 min,Master and Commander: The Far Side of the World,2003.0,7.4,"182,651",25105990.0,150000000,246.0,696.0
tt0333780,"Reese Witherspoon, Sally Field, Regina King, Jennifer Coolidge",3 wins & 4 nominations.,"$89,808,372",USA,Charles Herman-Wurmfeld,Comedy,English,MGM/UA,PG-13,02 Jul 2003,95 min,"Legally Blonde 2: Red, White & Blonde",2003.0,4.7,"52,484",22220670.0,45000000,131.0,295.0
tt0327056,"Sean Penn, Tim Robbins, Kevin Bacon, Laurence Fishburne",Won 2 Oscars. Another 53 wins & 142 nominations.,"$88,800,000","USA, Australia",Clint Eastwood,"Crime, Drama, Mystery",English,WB,R,15 Oct 2003,138 min,Mystic River,2003.0,8.0,"369,542",640815.0,25000000,235.0,955.0
tt0328880,"Joaquin Phoenix, Jeremy Suarez, Jason Raize, Rick Moranis",Nominated for 1 Oscar. Another 2 wins & 21 nominations.,"$85,095,337",USA,"Aaron Blaise, Robert Walker","Animation, Adventure, Comedy","English, Inuktitut, Croatian, Serbian",Buena Vista Pictures,G,01 Nov 2003,85 min,Brother Bear,2003.0,6.8,"80,679",291940.0,128000000,117.0,163.0
tt0329101,"Robert Englund, Ken Kirzinger, Monica Keena, Jason Ritter",2 wins & 10 nominations.,"$82,200,000","USA, Canada, Italy",Ronny Yu,"Action, Horror, Thriller",English,New Line Cinema,R,15 Aug 2003,97 min,Freddy vs. Jason,2003.0,5.8,"97,495",36428066.0,30000000,278.0,900.0
tt0332379,"Jack Black, Adam Pascal, Lucas Papaelias, Chris Stack",Nominated for 1 Golden Globe. Another 8 wins & 22 nominations.,"$81,200,000","USA, Germany",Richard Linklater,"Comedy, Family, Music",English,Paramount Pictures,PG-13,03 Oct 2003,108 min,School of Rock,2003.0,7.1,"229,185",19622714.0,35000000,205.0,493.0
tt0324216,"Jessica Biel, Jonathan Tucker, Erica Leerhsen, Mike Vogel",4 wins & 16 nominations.,"$80,148,261",USA,Marcus Nispel,Horror,English,New Line Cinema,R,17 Oct 2003,98 min,The Texas Chainsaw Massacre,2003.0,6.2,"117,224",28094014.0,9200000,241.0,737.0
tt0338094,"Eddie Murphy, Terence Stamp, Nathaniel Parker, Marsha Thomason",1 win & 4 nominations.,"$75,759,571",USA,Rob Minkoff,"Comedy, Family, Fantasy",English,Buena Vista Pictures,PG,26 Nov 2003,88 min,The Haunted Mansion,2003.0,4.9,"35,720",24278410.0,90000000,124.0,180.0
tt0302886,"Luke Wilson, Will Ferrell, Vince Vaughn, Jeremy Piven",5 nominations.,"$74,608,545",USA,Todd Phillips,Comedy,English,DreamWorks SKG,R,21 Feb 2003,88 min,Old School,2003.0,7.1,"196,508",17453216.0,24000000,126.0,405.0
tt0311289,"Sigourney Weaver, Jon Voight, Tim Blake Nelson, Shia LaBeouf",3 wins & 9 nominations.,"$67,325,559",USA,Andrew Davis,"Adventure, Comedy, Drama",English,Buena Vista Pictures,PG,18 Apr 2003,117 min,Holes,2003.0,7.1,"65,289",16300155.0,20000000,105.0,335.0
tt0311429,"Sean Connery, Naseeruddin Shah, Peta Wilson, Tony Curran",12 nominations.,"$66,327,144","USA, Germany, Czech Republic, UK",Stephen Norrington,"Action, Adventure, Fantasy","English, German, Italian",20th Century Fox,PG-13,11 Jul 2003,110 min,The League of Extraordinary Gentlemen,2003.0,5.8,"151,781",23075892.0,78000000,207.0,793.0
tt0319061,"Ewan McGregor, Albert Finney, Billy Crudup, Jessica Lange",Nominated for 1 Oscar. Another 68 nominations.,"$66,257,002",USA,Tim Burton,"Adventure, Drama, Fantasy","English, Cantonese",Sony Pictures,PG-13,09 Jan 2004,125 min,Big Fish,2003.0,8.0,"376,771",207377.0,70000000,241.0,833.0
tt0325703,"Angelina Jolie, Gerard Butler, Ciarán Hinds, Chris Barrie",1 win & 3 nominations.,"$65,700,000","USA, Germany, Japan, UK",Jan de Bont,"Action, Adventure, Fantasy","English, Mandarin",Paramount Pictures,PG-13,25 Jul 2003,117 min,Lara Croft Tomb Raider: The Cradle of Life,2003.0,5.5,"114,974",21783641.0,95000000,165.0,323.0
tt0304415,"Julia Roberts, Kirsten Dunst, Julia Stiles, Maggie Gyllenhaal",Nominated for 1 Golden Globe. Another 5 nominations.,"$63,695,760",USA,Mike Newell,Drama,"English, Italian",Sony Pictures Releasing,PG-13,19 Dec 2003,117 min,Mona Lisa Smile,2003.0,6.5,"67,487",11528498.0,65000000,140.0,271.0
tt0300471,"Jackie Chan, Owen Wilson, Aaron Taylor-Johnson, Tom Fisher",4 nominations.,"$60,447,592","USA, Hong Kong",David Dobkin,"Action, Adventure, Comedy","English, Mandarin",Touchstone Pictures,PG-13,07 Feb 2003,114 min,Shanghai Knights,2003.0,6.2,"89,063",19603630.0,50000000,166.0,194.0
tt0314331,"Bill Nighy, Gregor Fisher, Rory MacGregor, Colin Firth",Nominated for 2 Golden Globes. Another 10 wins & 27 nominations.,"$59,365,105","UK, USA, France",Richard Curtis,"Comedy, Drama, Romance","English, Portuguese, French",Universal Pictures,R,14 Nov 2003,135 min,Love Actually,2003.0,7.6,"358,671",6886080.0,40000000,226.0,1031.0
tt0348836,"Halle Berry, Robert Downey Jr., Charles S. Dutton, John Carroll Lynch",3 wins & 7 nominations.,"$59,537,388","USA, France, Canada, Spain",Mathieu Kassovitz,"Horror, Mystery, Thriller",English,Warner Bros. Pictures,R,21 Nov 2003,98 min,Gothika,2003.0,5.8,"96,158",19288438.0,40000000,206.0,381.0
tt0316356,"Robert Duvall, Kevin Costner, Annette Bening, Michael Gambon",1 win & 4 nominations.,"$58,260,046",USA,Kevin Costner,"Action, Drama, Romance",English,Buena Vista Pictures,R,15 Aug 2003,139 min,Open Range,2003.0,7.5,"58,444",14047781.0,22000000,158.0,506.0
tt0285823,"Antonio Banderas, Salma Hayek, Johnny Depp, Mickey Rourke",3 wins & 6 nominations.,"$55,900,000",USA,Robert Rodriguez,"Action, Thriller","English, Spanish",Sony Pictures Releasing,R,12 Sep 2003,102 min,Once Upon a Time in Mexico,2003.0,6.4,"139,395",23424118.0,29000000,175.0,471.0
tt0338337,"Ben Affleck, Aaron Eckhart, Uma Thurman, Paul Giamatti",3 wins & 2 nominations.,"$53,681,119","USA, Canada",John Woo,"Action, Mystery, Sci-Fi",English,Paramount Pictures,PG-13,25 Dec 2003,119 min,Paycheck,2003.0,6.3,"95,006",13462374.0,60000000,193.0,354.0
tt0292506,"Al Pacino, Colin Farrell, Bridget Moynahan, Gabriel Macht",2 nominations.,"$52,724,557",USA,Roger Donaldson,"Action, Drama, Mystery","English, Persian, Russian",Touchstone Pictures,PG-13,31 Jan 2003,115 min,The Recruit,2003.0,6.6,"120,548",16302063.0,46000000,156.0,289.0
tt0316465,"Cuba Gooding Jr., Ed Harris, Alfre Woodard, S. Epatha Merkerson",3 wins & 5 nominations.,"$52,277,485",USA,Michael Tollin,"Biography, Drama, Sport",English,Sony Pictures Entertainment,PG,24 Oct 2003,109 min,Radio,2003.0,6.9,"34,555",13303724.0,35000000,76.0,202.0
tt0309698,"John Cusack, Ray Liotta, Amanda Peet, John Hawkes",1 win & 11 nominations.,"$51,475,962",USA,James Mangold,"Mystery, Thriller",English,Columbia Pictures,R,25 Apr 2003,90 min,Identity,2003.0,7.3,"197,515",16225263.0,30000000,141.0,722.0
tt0320691,"Kate Beckinsale, Scott Speedman, Michael Sheen, Shane Brolly",1 win & 9 nominations.,"$51,483,949","USA, UK, Germany, Hungary",Len Wiseman,"Action, Fantasy, Thriller",English,Sony Screen Gems,R,19 Sep 2003,121 min,Underworld,2003.0,7.0,"230,536",21753759.0,22000000,228.0,820.0
tt0313542,"John Cusack, Gene Hackman, Dustin Hoffman, Rachel Weisz",3 nominations.,"$49,238,110",USA,Gary Fleder,"Crime, Drama, Thriller","English, French, Italian",20th Century Fox Distribution,PG-13,17 Oct 2003,127 min,Runaway Jury,2003.0,7.1,"82,570",11836705.0,60000000,166.0,368.0
tt0316396,"Jason Isaacs, Jeremy Sumpter, Rachel Hurd-Wood, Lynn Redgrave",3 wins & 13 nominations.,"$48,417,850","UK, Australia, USA",P.J. Hogan,"Adventure, Family, Fantasy",English,Universal Pictures,PG,25 Dec 2003,113 min,Peter Pan,2003.0,6.9,"58,665",11139495.0,100000000,160.0,484.0
tt0283426,"John Goodman, Haley Joel Osment, Mae Whitman, Connor Funk",1 win & 9 nominations.,"$47,840,957","USA, Australia",Steve Trenbirth,"Animation, Adventure, Family",English,Buena Vista,G,14 Feb 2003,72 min,The Jungle Book 2,2003.0,5.4,"12,965",14109797.0,20000000,84.0,63.0
tt0313911,"Frankie Muniz, Hilary Duff, Angie Harmon, Keith David",4 nominations.,"$47,285,499","USA, Canada",Harald Zwart,"Action, Adventure, Comedy",English,Metro-Goldwyn-Mayer (MGM),PG,14 Mar 2003,102 min,Agent Cody Banks,2003.0,5.1,"29,226",14064317.0,26000000,78.0,105.0
tt0327850,"Dwayne Johnson, Seann William Scott, Rosario Dawson, Christopher Walken",2 wins & 3 nominations.,"$47,592,825",USA,Peter Berg,"Action, Adventure, Comedy","English, Portuguese",Universal Pictures,PG-13,26 Sep 2003,104 min,The Rundown,2003.0,6.7,"89,112",18533765.0,85000000,153.0,260.0
tt0309593,"Ali Larter, A.J. Cook, Michael Landes, David Paetkau",4 nominations.,"$46,500,000","USA, Canada",David R. Ellis,"Fantasy, Horror, Mystery",English,New Line Cinema,R,31 Jan 2003,90 min,Final Destination 2,2003.0,6.2,"132,451",16017141.0,26000000,178.0,479.0
tt0335266,"Scarlett Johansson, Bill Murray, Akiko Takeshita, Kazuyoshi Minamimagoe",Won 1 Oscar. Another 97 wins & 126 nominations.,"$44,566,004","USA, Japan",Sofia Coppola,Drama,"English, Japanese, German, French",Focus Features,R,03 Oct 2003,102 min,Lost in Translation,2003.0,7.8,"353,130",925087.0,4000000,270.0,1876.0
tt0314353,"Bruce Willis, Monica Bellucci, Cole Hauser, Eamonn Walker",2 nominations.,"$43,426,961",USA,Antoine Fuqua,"Action, Drama, Thriller",English,Columbia Pictures,R,07 Mar 2003,121 min,Tears of the Sun,2003.0,6.6,"100,930",17057213.0,70000000,93.0,401.0
tt0328589,"Diane Lane, Sandra Oh, Lindsay Duncan, Raoul Bova",Nominated for 1 Golden Globe. Another 4 nominations.,"$43,452,354","USA, Italy",Audrey Wells,"Comedy, Drama, Romance","English, Italian, Polish, French, Spanish, German",Buena Vista Pictures,PG-13,26 Sep 2003,113 min,Under the Tuscan Sun,2003.0,6.8,"40,569",9751425.0,18000000,109.0,318.0
tt0306841,"Hilary Duff, Adam Lamberg, Hallie Todd, Robert Carradine",2 wins & 3 nominations.,"$42,672,630",USA,Jim Fall,"Adventure, Comedy, Family","English, Italian",Walt Disney Pictures,PG,02 May 2003,94 min,The Lizzie McGuire Movie,2003.0,5.4,"30,961",17338755.0,17000000,68.0,174.0
tt0327137,"Michael Caine, Robert Duvall, Haley Joel Osment, Kyra Sedgwick",1 win & 6 nominations.,"$41,407,470",USA,Tim McCanlies,"Comedy, Drama, Family",English,New Line Cinema,PG,19 Sep 2003,109 min,Secondhand Lions,2003.0,7.6,"46,618",12139832.0,30000000,82.0,299.0
tt0337711,"Elizabeth Daily, Nancy Cartwright, Kath Soucie, Dionne Quan",2 nominations.,"$39,400,000",USA,"John Eng, Norton Virgien","Animation, Adventure, Comedy",English,Paramount Pictures,PG,13 Jun 2003,80 min,Rugrats Go Wild,2003.0,5.6,"6,441",11556869.0,25000000,46.0,36.0
tt0325537,"Chris Rock, Bernie Mac, Dylan Baker, Nick Searcy",10 nominations.,"$37,788,228",USA,Chris Rock,Comedy,English,DreamWorks SKG,PG-13,28 Mar 2003,95 min,Head of State,2003.0,5.4,"15,995",13503484.0,35200000,45.0,83.0
tt0326900,"Molly Shannon, Liam Aiken, Kevin Nealon, Brittany Moldowan",3 nominations.,"$37,566,230",USA,John Hoffman,"Comedy, Drama, Family",English,MGM,PG,10 Oct 2003,87 min,Good Boy!,2003.0,5.1,"3,606",13107022.0,17000000,50.0,48.0
tt0263757,"Brittany Murphy, Dakota Fanning, Marley Shelton, Donald Faison",1 nomination.,"$36,922,190",USA,Boaz Yakin,"Comedy, Drama, Romance",English,Metro-Goldwyn-Mayer,PG-13,15 Aug 2003,92 min,Uptown Girls,2003.0,6.1,"31,444",11277367.0,20000000,72.0,132.0
tt0325805,"Nicolas Cage, Sam Rockwell, Alison Lohman, Bruce Altman",5 nominations.,"$36,873,198","USA, UK",Ridley Scott,"Comedy, Crime, Drama",English,Warner Bros. Pictures,PG-13,12 Sep 2003,116 min,Matchstick Men,2003.0,7.3,"113,998",13087307.0,62000000,158.0,344.0
tt0286788,"Amanda Bynes, Colin Firth, Kelly Preston, Eileen Atkins",1 win.,"$35,990,505",USA,Dennie Gordon,"Comedy, Drama, Family",English,Warner Bros. Pictures,PG,04 Apr 2003,105 min,What a Girl Wants,2003.0,5.8,"52,318",11434964.0,20000000,68.0,195.0
tt0301470,"Ray Wise, Jonathan Breck, Garikayi Mutambirwa, Eric Nenninger",6 nominations.,"$35,200,000",USA,Victor Salva,Horror,English,MGM/UA,R,29 Aug 2003,104 min,Jeepers Creepers II,2003.0,5.6,"51,330",18365222.0,17000000,171.0,320.0
tt0138524,"George Clooney, Catherine Zeta-Jones, Geoffrey Rush, Cedric the Entertainer",3 nominations.,"$35,096,190",USA,"Joel Coen, Ethan Coen","Comedy, Crime, Romance","English, French",Universal Pictures,PG-13,10 Oct 2003,100 min,Intolerable Cruelty,2003.0,6.3,"82,390",12525075.0,60000000,166.0,330.0
tt0306685,"Jet Li, DMX, Anthony Anderson, Kelly Hu",6 nominations.,"$34,600,000",USA,Andrzej Bartkowiak,"Action, Crime, Drama","English, Mandarin, Korean",Warner Bros.,R,28 Feb 2003,101 min,Cradle 2 the Grave,2003.0,5.8,"37,591",16521486.0,30000000,111.0,186.0
tt0340855,"Charlize Theron, Christina Ricci, Bruce Dern, Lee Tergesen",Won 1 Oscar. Another 29 wins & 25 nominations.,"$34,187,787","Germany, USA",Patty Jenkins,"Biography, Crime, Drama",English,Newmarket Film Group,R,30 Jan 2004,109 min,Monster,2003.0,7.3,"117,776",86831.0,4500000,187.0,545.0
tt0328099,"Jamie Kennedy, Taye Diggs, Anthony Anderson, Regina Hall",3 nominations.,"$34,308,901",USA,John Whitesell,"Comedy, Crime",English,Warner Bros.,PG-13,18 Apr 2003,86 min,Malibu's Most Wanted,2003.0,5.1,"16,994",12618159.0,16000000,36.0,89.0
tt0269347,"Tommy Lee Jones, Benicio Del Toro, Connie Nielsen, Leslie Stefanson",2 nominations.,"$34,195,533",USA,William Friedkin,"Action, Crime, Drama","English, Serbo-Croatian",Paramount Pictures,R,14 Mar 2003,94 min,The Hunted,2003.0,6.0,"38,950",13482638.0,55000000,134.0,320.0
tt0285531,"Morgan Freeman, Thomas Jane, Jason Lee, Damian Lewis",5 nominations.,"$33,700,000",USA,Lawrence Kasdan,"Drama, Horror, Sci-Fi",English,Warner Bros. Pictures,R,21 Mar 2003,134 min,Dreamcatcher,2003.0,5.5,"81,681",15027423.0,68000000,180.0,675.0
tt0282209,"Chaney Kley, Emma Caulfield Ford, Lee Cormie, Grant Piro",1 win & 2 nominations.,"$32,032,215","USA, Australia",Jonathan Liebesman,"Fantasy, Horror, Mystery",English,Sony Pictures Releasing,PG-13,24 Jan 2003,86 min,Darkness Falls,2003.0,5.0,"27,589",12024917.0,11000000,140.0,371.0
