imdbID,Actors,Awards,BoxOffice,Country,Director,Genre,Language,Production,Rated,Released,Runtime,Title,Year,imdbRating,imdbVotes,Opening Weekend USA,budget,critic number,user review number
tt1625150,"Ben Van den Heuvel, Eva van der Gucht, Thomas Coumans, Katelijne Damen",3 wins & 3 nominations.,"$16,710",Belgium,Bavo Defurne,"Drama, Romance","Dutch, German, French, English",Strand Releasing,NOT RATED,02 Nov 2012,94 min,North Sea Texas,2011.0,7.2,"6,866",4487.0,,43.0,22.0
tt1788391,"Neil Maskell, MyAnna Buring, Harry Simpson, Michael Smiley",3 wins & 16 nominations.,"$26,297",UK,Ben Wheatley,"Crime, Drama, Horror","English, Swedish",IFC Films,NOT RATED,02 Sep 2011,95 min,Kill List,2011.0,6.4,"30,043",9838.0,500000,259.0,225.0
tt1674775,"Jason Patric, Isabella Rossellini, Udo Kier, Louis Negin",1 win & 3 nominations.,"$22,099",Canada,Guy Maddin,"Drama, Thriller","English, French",Monterey Media,R,22 Feb 2012,94 min,Keyhole,2011.0,5.5,"1,200",3884.0,,73.0,15.0
tt1204340,"Peter Mullan, Archie Lal, Jag Sanghera, Mike Fearnley",Won 1 BAFTA Film Award. Another 20 wins & 22 nominations.,"$22,088",UK,Paddy Considine,Drama,English,Strand Releasing,NOT RATED,07 Oct 2011,92 min,Tyrannosaur,2011.0,7.6,"26,575",7635.0,,230.0,96.0
tt1535616,"Lauren German, Michael Biehn, Milo Ventimiglia, Courtney B. Vance",1 win & 5 nominations.,"$18,000","Germany, USA, Canada, France",Xavier Gens,"Drama, Horror, Sci-Fi",English,Anchor Bay Entertainment,R,20 Apr 2012,112 min,The Divide,2011.0,5.8,"32,450",18000.0,3000000,174.0,234.0
tt1913002,"Diego Noguera, Alicia Fehrmann, Andrés Waas, Nathalia Galgani",3 wins & 3 nominations.,"$21,163","Chile, Argentina, Portugal, France",Cristián Jiménez,Drama,Spanish,Strand Releasing,NOT RATED,09 Nov 2011,95 min,Bonsái,2011.0,6.4,716,2293.0,,44.0,5.0
tt1756799,"Shawn Ashmore, Brianna Barnes, Ashley Bell, Brayden Edwards",2 nominations.,"$20,502",USA,Douglas Aarniokoski,"Action, Drama, Horror",English,Anchor Bay Entertainment,R,20 Sep 2012,87 min,The Day,2011.0,5.2,"11,332",10121.0,,73.0,74.0
tt0363771,"Georgie Henley, Skandar Keynes, William Moseley, Anna Popplewell",Won 1 Oscar. Another 14 wins & 46 nominations.,"$291,685,219","USA, UK",Andrew Adamson,"Adventure, Family, Fantasy","English, German",Buena Vista,PG,09 Dec 2005,143 min,"The Chronicles of Narnia: The Lion, the Witch and the Wardrobe",2005.0,6.9,"321,011",65556312.0,180000000,280.0,1483.0
tt0330373,"Eric Sykes, Timothy Spall, David Tennant, Daniel Radcliffe",Nominated for 1 Oscar. Another 13 wins & 42 nominations.,"$289,994,397","UK, USA",Mike Newell,"Adventure, Family, Fantasy","English, French",Warner Bros. Pictures,PG-13,18 Nov 2005,157 min,Harry Potter and the Goblet of Fire,2005.0,7.7,"445,699",102335066.0,150000000,306.0,1912.0
tt0407304,"Tom Cruise, Dakota Fanning, Miranda Otto, Justin Chatwin",Nominated for 3 Oscars. Another 14 wins & 44 nominations.,"$234,141,872",USA,Steven Spielberg,"Adventure, Sci-Fi, Thriller",English,Paramount Pictures,PG-13,29 Jun 2005,116 min,War of the Worlds,2005.0,6.5,"366,410",77061953.0,132000000,402.0,2762.0
tt0360717,"Naomi Watts, Jack Black, Adrien Brody, Thomas Kretschmann",Won 3 Oscars. Another 43 wins & 100 nominations.,"$218,100,000","New Zealand, USA, Germany",Peter Jackson,"Action, Adventure, Drama",English,Universal Pictures,PG-13,14 Dec 2005,187 min,King Kong,2005.0,7.2,"347,854",,,451.0,2643.0
tt0396269,"Owen Wilson, Vince Vaughn, Christopher Walken, Rachel McAdams",11 wins & 11 nominations.,"$209,218,368",USA,David Dobkin,"Comedy, Romance",English,New Line Cinema,R,15 Jul 2005,119 min,Wedding Crashers,2005.0,7.0,"301,916",33900720.0,40000000,186.0,652.0
tt0372784,"Christian Bale, Michael Caine, Liam Neeson, Katie Holmes",Nominated for 1 Oscar. Another 14 wins & 72 nominations.,"$204,100,000","USA, UK",Christopher Nolan,"Action, Adventure, Thriller","English, Urdu, Mandarin",Warner Bros. Pictures,PG-13,15 Jun 2005,140 min,Batman Begins,2005.0,8.3,"1,115,046",48745440.0,150000000,466.0,2729.0
tt0367594,"Johnny Depp, Freddie Highmore, David Kelly, Helena Bonham Carter",Nominated for 1 Oscar. Another 14 wins & 50 nominations.,"$206,100,000","USA, UK, Australia",Tim Burton,"Adventure, Comedy, Family",English,Warner Bros. Pictures,PG,15 Jul 2005,115 min,Charlie and the Chocolate Factory,2005.0,6.7,"363,521",56178450.0,150000000,281.0,1379.0
tt0351283,"Ben Stiller, Chris Rock, David Schwimmer, Jada Pinkett Smith",4 wins & 31 nominations.,"$193,136,719",USA,"Eric Darnell, Tom McGrath","Animation, Adventure, Comedy","English, Portuguese, Spanish, German, French",Dreamworks,PG,27 May 2005,86 min,Madagascar,2005.0,6.9,"304,552",61012130.0,75000000,179.0,390.0
tt0356910,"Brad Pitt, Angelina Jolie, Vince Vaughn, Adam Brody",9 wins & 18 nominations.,"$186,200,000",USA,Doug Liman,"Action, Comedy, Crime","English, Spanish",20th Century Fox,PG-13,10 Jun 2005,120 min,Mr. & Mrs. Smith,2005.0,6.5,"392,650",50342878.0,120000000,230.0,805.0
tt0386588,"Will Smith, Eva Mendes, Kevin James, Amber Valletta",4 wins & 24 nominations.,"$177,575,142",USA,Andy Tennant,"Comedy, Romance",English,Sony Pictures,PG-13,11 Feb 2005,118 min,Hitch,2005.0,6.6,"264,484",43142214.0,70000000,170.0,384.0
tt0398165,"Adam Sandler, Chris Rock, Burt Reynolds, Nelly",2 wins & 17 nominations.,"$157,900,000",USA,Peter Segal,"Comedy, Crime, Sport",English,Paramount Pictures,PG-13,27 May 2005,113 min,The Longest Yard,2005.0,6.4,"142,145",58613245.0,82000000,135.0,324.0
tt0120667,"Ioan Gruffudd, Jessica Alba, Chris Evans, Michael Chiklis",3 wins & 12 nominations.,"$154,485,963","USA, Germany",Tim Story,"Action, Adventure, Family",English,20th Century Fox,PG-13,08 Jul 2005,106 min,Fantastic Four,2005.0,5.7,"284,782",56061504.0,100000000,278.0,1021.0
tt0371606,"Zach Braff, Garry Marshall, Don Knotts, Patrick Stewart",4 wins & 15 nominations.,"$135,289,768","USA, India, Syria, China",Mark Dindal,"Animation, Adventure, Comedy","English, Hindi, Bengali",Buena Vista Pictures,G,04 Nov 2005,81 min,Chicken Little,2005.0,5.8,"72,847",40049778.0,150000000,152.0,264.0
tt0358082,"Paula Abdul, Halle Berry, Lucille Bliss, Terry Bradshaw",2 wins & 22 nominations.,"$128,107,031",USA,"Chris Wedge, Carlos Saldanha(co-director)","Animation, Adventure, Comedy","English, Italian",20th Century Fox,PG,11 Mar 2005,91 min,Robots,2005.0,6.3,"114,975",36045301.0,75000000,162.0,273.0
tt0358273,"Joaquin Phoenix, Reese Witherspoon, Ginnifer Goodwin, Robert Patrick",Won 1 Oscar. Another 44 wins & 46 nominations.,"$119,317,827","USA, Germany",James Mangold,"Biography, Drama, Music","English, Russian",20th Century Fox,PG-13,18 Nov 2005,136 min,Walk the Line,2005.0,7.9,"202,864",22347341.0,28000000,289.0,857.0
tt0395699,"Vin Diesel, Lauren Graham, Faith Ford, Brittany Snow",1 win & 10 nominations.,"$113,006,880","Canada, USA",Adam Shankman,"Action, Comedy, Drama","English, Korean",Buena Vista,PG,04 Mar 2005,95 min,The Pacifier,2005.0,5.6,"75,646",30552694.0,56000000,127.0,229.0
tt0369441,"Jim Carrey, Téa Leoni, Alec Baldwin, Richard Jenkins",7 nominations.,"$110,332,737",USA,Dean Parisot,"Comedy, Crime","English, Spanish",Columbia Pictures,PG-13,21 Dec 2005,90 min,Fun with Dick and Jane,2005.0,6.1,"119,547",21530160.0,100000000,134.0,262.0
tt0405422,"Steve Carell, Catherine Keener, Paul Rudd, Romany Malco",10 wins & 19 nominations.,"$109,243,478",USA,Judd Apatow,"Comedy, Romance","English, Spanish, Japanese",Universal Pictures,R,19 Aug 2005,116 min,The 40-Year-Old Virgin,2005.0,7.1,"343,022",21422815.0,26000000,178.0,552.0
tt0408790,"Jodie Foster, Peter Sarsgaard, Sean Bean, Kate Beahan",2 wins & 6 nominations.,"$89,602,378",USA,Robert Schwentke,"Drama, Mystery, Thriller","English, French, German, Arabic, Italian, Japanese",Touchstone Pictures,PG-13,23 Sep 2005,98 min,Flightplan,2005.0,6.3,"136,675",24629938.0,55000000,224.0,601.0
tt0432348,"Tobin Bell, Shawnee Smith, Donnie Wahlberg, Erik Knudsen",4 wins & 8 nominations.,"$87,025,093","USA, Canada",Darren Lynn Bousman,"Horror, Mystery",English,Lions Gate Films,R,28 Oct 2005,93 min,Saw II,2005.0,6.6,"208,534",31725652.0,4000000,254.0,882.0
tt0388795,"Heath Ledger, Jake Gyllenhaal, Randy Quaid, Valerie Planche",Won 3 Oscars. Another 138 wins & 128 nominations.,"$82,970,165","USA, Canada",Ang Lee,Drama,"English, Spanish",Focus Features,R,13 Jan 2006,134 min,Brokeback Mountain,2005.0,7.7,"283,736",547425.0,14000000,292.0,2277.0
tt0369735,"Jennifer Lopez, Jane Fonda, Michael Vartan, Wanda Sykes",1 win & 10 nominations.,"$82,820,167","Germany, USA",Robert Luketic,"Comedy, Romance",English,New Line Cinema,PG-13,13 May 2005,101 min,Monster-in-Law,2005.0,5.5,"48,904",23105133.0,60000000,130.0,232.0
tt0368578,"Ice Cube, Nia Long, Aleisha Allen, Philip Bolden",1 win & 8 nominations.,"$82,301,521","USA, Canada",Brian Levant,"Adventure, Comedy, Family",English,Sony Pictures,PG,21 Jan 2005,95 min,Are We There Yet?,2005.0,4.6,"25,314",18575214.0,32000000,75.0,152.0
tt0452598,"Steve Martin, Eugene Levy, Bonnie Hunt, Tom Welling",1 win & 5 nominations.,"$82,468,131","USA, Canada",Adam Shankman,"Adventure, Comedy, Family",English,20th Century Fox,PG,21 Dec 2005,94 min,Cheaper by the Dozen 2,2005.0,5.5,"47,451",15340679.0,60000000,76.0,129.0
tt0377818,"Johnny Knoxville, Seann William Scott, Alice Greczyn, Steve Lemme",5 wins & 14 nominations.,"$80,206,743",USA,Jay Chandrasekhar,"Action, Adventure, Comedy",English,Warner Bros. Pictures,PG-13,05 Aug 2005,104 min,The Dukes of Hazzard,2005.0,5.1,"69,969",30675314.0,50000000,142.0,621.0
tt0377109,"Naomi Watts, Simon Baker, David Dorfman, Elizabeth Perkins",2 wins & 11 nominations.,"$75,888,270",USA,Hideo Nakata,"Horror, Mystery",English,Dreamworks Distribution LLC,PG-13,18 Mar 2005,110 min,The Ring Two,2005.0,5.4,"80,543",35065237.0,50000000,201.0,568.0
tt0360486,"Keanu Reeves, Rachel Weisz, Shia LaBeouf, Djimon Hounsou",2 wins & 9 nominations.,"$75,400,000","USA, Germany",Francis Lawrence,"Drama, Fantasy, Thriller","English, Filipino, Tagalog",Warner Bros. Pictures,R,18 Feb 2005,121 min,Constantine,2005.0,7.0,"260,990",33624407.0,100000000,286.0,1022.0
tt0373926,"Nicole Kidman, Sean Penn, Catherine Keener, Jesper Christensen",3 wins & 2 nominations.,"$72,515,360","UK, France, Germany, USA, South Africa",Sydney Pollack,"Crime, Mystery, Thriller","Aboriginal, English, French, Portuguese",Universal Pictures,PG-13,22 Apr 2005,128 min,The Interpreter,2005.0,6.4,"90,511",22822455.0,80000000,227.0,412.0
tt0434409,"Natalie Portman, Hugo Weaving, Stephen Rea, Stephen Fry",7 wins & 27 nominations.,"$70,500,000","USA, UK, Germany",James McTeigue,"Action, Drama, Sci-Fi",English,Warner Bros. Pictures,R,17 Mar 2006,132 min,V for Vendetta,2005.0,8.2,"899,595",25642640.0,54000000,530.0,2092.0
tt0372237,"Bernie Mac, Ashton Kutcher, Zoe Saldana, Judith Scott",16 nominations.,"$67,962,333",USA,Kevin Rodney Sullivan,"Comedy, Romance",English,Sony Pictures,PG-13,25 Mar 2005,105 min,Guess Who,2005.0,5.9,"36,241",20671446.0,35000000,104.0,161.0
tt0318649,"Matthew McConaughey, Steve Zahn, Penélope Cruz, William H. Macy",2 wins & 5 nominations.,"$68,642,452","UK, Spain, Germany, USA",Breck Eisner,"Action, Adventure, Comedy","English, French, Arabic",Paramount Pictures,PG-13,08 Apr 2005,124 min,Sahara,2005.0,6.0,"82,946",18068372.0,130000000,164.0,471.0
tt0393162,"Samuel L. Jackson, Rob Brown, Robert Ri'chard, Rick Gonzalez",3 wins & 15 nominations.,"$67,169,549","USA, Germany",Thomas Carter,"Biography, Drama, Sport",English,Paramount Pictures,PG-13,14 Jan 2005,136 min,Coach Carter,2005.0,7.3,"103,641",29168180.0,30000000,124.0,217.0
tt0400497,"Lindsay Lohan, Michael Keaton, Matt Dillon, Breckin Meyer",2 wins & 6 nominations.,"$65,942,664",USA,Angela Robinson,"Adventure, Comedy, Family",English,Buena Vista,G,22 Jun 2005,101 min,Herbie Fully Loaded,2005.0,4.8,"39,871",12709221.0,50000000,117.0,171.0
tt0384806,"Ryan Reynolds, Melissa George, Jesse James, Jimmy Bennett",2 wins & 4 nominations.,"$64,255,243",USA,Andrew Douglas,"Drama, Horror, Mystery",English,MGM,R,15 Apr 2005,90 min,The Amityville Horror,2005.0,6.0,"93,559",23507007.0,19000000,186.0,532.0
tt0405325,"Michael Angarano, Kurt Russell, Kelly Preston, Danielle Panabaker",1 nomination.,"$63,939,454",USA,Mike Mitchell,"Adventure, Comedy, Family","English, Cantonese",Buena Vista,PG,29 Jul 2005,100 min,Sky High,2005.0,6.2,"68,053",14631784.0,35000000,131.0,222.0
tt0418763,"Jake Gyllenhaal, Scott MacDonald, Peter Sarsgaard, Jamie Foxx",6 wins & 12 nominations.,"$62,578,105","USA, UK, Germany",Sam Mendes,"Biography, Drama, War","English, Spanish, Arabic, Latin",Universal Pictures,R,04 Nov 2005,125 min,Jarhead,2005.0,7.0,"155,295",27726210.0,72000000,263.0,660.0
tt0374536,"Nicole Kidman, Will Ferrell, Shirley MacLaine, Michael Caine",2 wins & 13 nominations.,"$62,252,415",USA,Nora Ephron,"Comedy, Fantasy, Romance","English, Spanish",Columbia Pictures,PG-13,24 Jun 2005,102 min,Bewitched,2005.0,4.8,"62,586",20131130.0,85000000,166.0,494.0
tt0352248,"Russell Crowe, Renée Zellweger, Paul Giamatti, Craig Bierko",Nominated for 3 Oscars. Another 16 wins & 41 nominations.,"$61,600,000",USA,Ron Howard,"Biography, Drama, Sport",English,Universal Pictures,PG-13,03 Jun 2005,144 min,Cinderella Man,2005.0,8.0,"159,831",18320205.0,88000000,206.0,542.0
tt0356680,"Claire Danes, Diane Keaton, Rachel McAdams, Dermot Mulroney",Nominated for 1 Golden Globe. Another 4 wins & 7 nominations.,"$59,856,288",USA,Thomas Bezucha,"Comedy, Drama, Romance","English, American Sign Language",20th Century Fox Distribution,PG-13,16 Dec 2005,103 min,The Family Stone,2005.0,6.3,"53,714",12521027.0,17000000,141.0,479.0
tt0421239,"Rachel McAdams, Cillian Murphy, Brian Cox, Laura Johnson",2 wins & 9 nominations.,"$57,859,105",USA,Wes Craven,"Mystery, Thriller","English, Russian",Dreamworks,PG-13,19 Aug 2005,85 min,Red Eye,2005.0,6.5,"100,903",16167662.0,26000000,213.0,681.0
tt0397535,"Suzuka Ohgo, Togo Igawa, Mako, Samantha Futerman",Won 3 Oscars. Another 27 wins & 44 nominations.,"$57,000,000",USA,Rob Marshall,"Drama, Romance","English, Japanese",Sony Pictures,PG-13,23 Dec 2005,145 min,Memoirs of a Geisha,2005.0,7.4,"126,971",682504.0,85000000,226.0,552.0
tt0375210,"Michael Keaton, Chandra West, Deborah Kara Unger, Ian McNeice",1 win & 2 nominations.,"$55,865,715","UK, Canada, USA",Geoffrey Sax,"Drama, Horror, Mystery",English,Universal Pictures,PG-13,07 Jan 2005,101 min,White Noise,2005.0,5.5,"44,108",24113565.0,10000000,175.0,404.0
tt0312004,"Peter Sallis, Ralph Fiennes, Helena Bonham Carter, Peter Kay",Won 1 Oscar. Another 38 wins & 25 nominations.,"$56,068,547","UK, USA","Steve Box, Nick Park","Animation, Adventure, Comedy",English,Dreamworks,G,07 Oct 2005,85 min,The Curse of the Were-Rabbit,2005.0,7.5,"108,596",16025987.0,30000000,207.0,314.0
tt0377471,"John Travolta, Uma Thurman, Vince Vaughn, Cedric the Entertainer",1 win & 13 nominations.,"$55,590,667",USA,F. Gary Gray,"Comedy, Crime, Music","English, Russian",MGM/UA,PG-13,04 Mar 2005,118 min,Be Cool,2005.0,5.7,"62,607",23450212.0,53000000,160.0,323.0
tt0443295,"Dennis Quaid, Rene Russo, Sean Faris, Katija Pevec",2 wins & 4 nominations.,"$53,359,917",USA,Raja Gosnell,"Comedy, Family, Fantasy",English,Paramount Pictures,PG,23 Nov 2005,88 min,"Yours, Mine & Ours",2005.0,5.4,"23,707",17461108.0,45000000,73.0,110.0
tt0121164,"Johnny Depp, Helena Bonham Carter, Emily Watson, Tracey Ullman",Nominated for 1 Oscar. Another 8 wins & 28 nominations.,"$53,300,000","USA, UK","Tim Burton, Mike Johnson","Animation, Drama, Family",English,Warner Bros. Pictures,PG,23 Sep 2005,77 min,Corpse Bride,2005.0,7.4,"211,921",385078.0,40000000,272.0,489.0
tt0384642,"Will Ferrell, Robert Duvall, Mike Ditka, Kate Walsh",7 nominations.,"$52,580,895",USA,Jesse Dylan,"Comedy, Family, Romance","English, Italian",Universal Pictures,PG,13 May 2005,95 min,Kicking & Screaming,2005.0,5.6,"32,543",20159925.0,45000000,94.0,119.0
tt0443536,"Anne Hathaway, Glenn Close, Jim Belushi, Patrick Warburton",1 nomination.,"$50,802,483",USA,"Cory Edwards, Todd Edwards(co-director), Tony Leech(co-director)","Animation, Action, Comedy","English, Spanish",Weinstein Company,PG,13 Jan 2006,80 min,Hoodwinked!,2005.0,6.5,"49,988",16879402.0,17500000,142.0,255.0
tt0382077,"Robert De Niro, Dakota Fanning, Famke Janssen, Elisabeth Shue",1 win & 5 nominations.,"$51,100,000","USA, Germany",John Polson,"Drama, Horror, Mystery",English,20th Century Fox,R,28 Jan 2005,101 min,Hide and Seek,2005.0,5.9,"75,084",21959233.0,30000000,180.0,451.0
tt0371724,"Bill Bailey, Anna Chancellor, Warwick Davis, Yasiin Bey",1 win & 10 nominations.,"$51,019,112","UK, USA",Garth Jennings,"Adventure, Comedy, Sci-Fi",English,Buena Vista,PG,29 Apr 2005,109 min,The Hitchhiker's Guide to the Galaxy,2005.0,6.8,"169,003",21103203.0,50000000,279.0,1071.0
tt0365737,"Kayvan Novak, George Clooney, Amr Waked, Christopher Plummer",Won 1 Oscar. Another 13 wins & 28 nominations.,"$50,800,000","USA, United Arab Emirates",Stephen Gaghan,"Drama, Thriller","English, Urdu, Arabic, Persian, French, Mandarin",Warner Bros. Pictures,R,09 Dec 2005,128 min,Syriana,2005.0,7.0,"116,564",374502.0,50000000,356.0,625.0
tt0422093,"Kimberly Elise, Steve Harris, Tyler Perry, Shemar Moore",13 wins & 13 nominations.,"$50,382,128",USA,Darren Grant,"Comedy, Drama, Romance",English,Lions Gate Films,PG-13,25 Feb 2005,116 min,Diary of a Mad Black Woman,2005.0,5.7,"11,373",21905089.0,5500000,60.0,203.0
tt0376105,"Bruce Greenwood, Hayden Panettiere, Caspar Poyck, Gary Bullock",3 nominations.,"$49,186,871",USA,Frederik Du Chau,"Adventure, Comedy, Drama",English,Warner Bros. Pictures,PG,14 Jan 2005,102 min,Racing Stripes,2005.0,5.2,"13,838",18862432.0,30000000,75.0,85.0
tt0385307,"Sandra Bullock, Regina King, Enrique Murciano, William Shatner",2 wins & 5 nominations.,"$47,100,000",USA,John Pasquin,"Action, Comedy, Crime",English,Warner Bros.,PG-13,24 Mar 2005,115 min,Miss Congeniality 2: Armed and Fabulous,2005.0,5.0,"58,244",14043215.0,45000000,111.0,160.0
tt0425123,"Reese Witherspoon, Mark Ruffalo, Donal Logue, Dina Spybey-Waters",1 win & 1 nomination.,"$48,291,624",USA,Mark Waters,"Comedy, Fantasy, Romance","English, Spanish, Mandarin",Dreamworks,PG-13,16 Sep 2005,95 min,Just Like Heaven,2005.0,6.7,"89,085",16408718.0,58000000,115.0,268.0
tt0397101,"Kate Hudson, Gena Rowlands, John Hurt, Peter Sarsgaard",5 nominations.,"$47,729,605","USA, Germany",Iain Softley,"Horror, Mystery, Thriller","English, French",Universal Pictures,PG-13,12 Aug 2005,104 min,The Skeleton Key,2005.0,6.5,"95,297",16057945.0,43000000,194.0,381.0
tt0408306,"Eric Bana, Daniel Craig, Ciarán Hinds, Mathieu Kassovitz",Nominated for 5 Oscars. Another 13 wins & 65 nominations.,"$47,379,090","France, Canada, USA",Steven Spielberg,"Drama, History, Thriller","English, German, French, Hebrew, Arabic, Italian, Greek, Russian, Dutch",Universal Pictures,R,06 Jan 2006,164 min,Munich,2005.0,7.6,"190,300",6040860.0,70000000,307.0,836.0
tt0320661,"Martin Hancock, Michael Sheen, Nathalie Cox, Eriq Ebouaney",5 wins & 14 nominations.,"$47,259,055","USA, UK, Spain, Germany, Morocco",Ridley Scott,"Action, Adventure, Drama","English, Arabic, Latin, Italian",20th Century Fox,R,06 May 2005,144 min,Kingdom of Heaven,2005.0,7.2,"237,988",19635996.0,130000000,240.0,953.0
tt0450278,"Jay Hernandez, Derek Richardson, Eythor Gudjonsson, Barbara Nedeljakova",4 wins & 12 nominations.,"$47,277,326","USA, Germany, Czech Republic, Slovakia, Iceland",Eli Roth,"Horror, Mystery, Thriller","English, Czech, German, Dutch, Slovak, Japanese, Icelandic, Russian, Spanish",Lions Gate Films,R,06 Jan 2006,94 min,Hostel,2005.0,5.9,"152,137",19556099.0,4800000,302.0,1534.0
tt0396752,"Emma Thompson, Colin Firth, Kelly Macdonald, Thomas Brodie-Sangster",3 wins & 4 nominations.,"$47,124,400","USA, UK, France",Kirk Jones,"Comedy, Family, Fantasy",English,Universal Pictures,PG,27 Jan 2006,97 min,Nanny McPhee,2005.0,6.6,"56,908",14503650.0,25000000,128.0,182.0
tt0386140,"Alberto Reyes, Julio Oscar Mechoso, Gustavo Sánchez Parra, Adrian Alonso",2 wins & 3 nominations.,"$45,356,386",USA,Martin Campbell,"Action, Adventure, Western","Spanish, English",Sony Pictures Entertainment,PG,28 Oct 2005,129 min,The Legend of Zorro,2005.0,5.9,"80,271",16328506.0,75000000,135.0,247.0
tt0417001,"Diane Lane, John Cusack, Elizabeth Perkins, Christopher Plummer",1 nomination.,"$43,800,000",USA,Gary David Goldberg,"Comedy, Romance","English, Armenian",Warner Bros. Pictures,PG-13,29 Jul 2005,98 min,Must Love Dogs,2005.0,5.9,"28,010",12855321.0,30000000,118.0,265.0
tt0332047,"Drew Barrymore, Jimmy Fallon, Jason Spevack, Jack Kehler",9 nominations.,"$41,966,965","USA, Germany","Bobby Farrelly, Peter Farrelly","Comedy, Drama, Romance",English,20th Century Fox,PG-13,08 Apr 2005,104 min,Fever Pitch,2005.0,6.2,"38,461",12400125.0,30000000,123.0,210.0
tt0403508,"Amber Tamblyn, Alexis Bledel, America Ferrera, Blake Lively",1 win & 14 nominations.,"$43,504,854",USA,Ken Kwapis,"Comedy, Drama, Family","English, Greek, Spanish",Warner Bros. Pictures,PG,01 Jun 2005,119 min,The Sisterhood of the Traveling Pants,2005.0,6.5,"48,248",9833340.0,25000000,89.0,224.0
tt0414387,"Keira Knightley, Talulah Riley, Rosamund Pike, Jena Malone",Nominated for 4 Oscars. Another 13 wins & 54 nominations.,"$38,251,759","France, UK, USA",Joe Wright,"Drama, Romance",English,Focus Features,PG,23 Nov 2005,129 min,Pride & Prejudice,2005.0,7.8,"214,748",2865017.0,28000000,179.0,1083.0
tt0388500,"Queen Latifah, Alicia Silverstone, Andie MacDowell, Alfre Woodard",15 nominations.,"$36,310,118",USA,Bille Woodruff,Comedy,English,MGM/UA,PG-13,30 Mar 2005,105 min,Beauty Shop,2005.0,5.5,"14,565",12801465.0,,70.0,59.0
tt0399201,"Ewan McGregor, Scarlett Johansson, Djimon Hounsou, Sean Bean",1 win & 6 nominations.,"$35,800,000",USA,Michael Bay,"Action, Adventure, Romance",English,Dreamworks Distribution LLC,PG-13,22 Jul 2005,136 min,The Island,2005.0,6.9,"280,675",12409070.0,126000000,255.0,910.0
tt0267891,"Johnny Knoxville, Brian Cox, Katherine Heigl, Jed Rees",1 nomination.,"$35,019,634",USA,Barry W. Blaustein,"Comedy, Sport",English,Fox Searchlight Pictures,PG-13,23 Dec 2005,94 min,The Ringer,2005.0,5.8,"32,734",7702439.0,,88.0,163.0
tt0340163,"Bruce Willis, Kevin Pollak, Jimmy Bennett, Michelle Horn",4 nominations.,"$34,617,915","USA, Germany",Florent-Emilio Siri,"Action, Crime, Drama",English,Miramax,R,11 Mar 2005,113 min,Hostage,2005.0,6.6,"99,313",10214734.0,52000000,152.0,292.0
tt0387131,"Ralph Fiennes, Rachel Weisz, Hubert Koundé, Danny Huston",Won 1 Oscar. Another 35 wins & 68 nominations.,"$33,565,375","UK, Germany, USA, China",Fernando Meirelles,"Drama, Mystery, Romance","English, Italian, Swahili, German",Focus Features,R,31 Aug 2005,129 min,The Constant Gardener,2005.0,7.4,"120,152",,,220.0,571.0
tt0388125,"Cameron Diaz, Anson Mount, Toni Collette, Richard Burgi",Nominated for 1 Golden Globe. Another 1 win & 6 nominations.,"$32,815,761","USA, Germany, UK",Curtis Hanson,"Comedy, Drama, Romance",English,20th Century Fox,PG-13,07 Oct 2005,130 min,In Her Shoes,2005.0,6.5,"55,002",10017575.0,,162.0,164.0
tt0418647,"Kurt Russell, Dakota Fanning, Kris Kristofferson, Elisabeth Shue",1 win & 5 nominations.,"$33,022,286",USA,John Gatins,"Drama, Family, Sport",English,Dreamworks,PG,21 Oct 2005,106 min,Dreamer: Inspired by a True Story,2005.0,6.9,"10,764",9178233.0,32000000,75.0,111.0
tt0317132,"AnnaSophia Robb, Jeff Daniels, Cicely Tyson, Dave Matthews",2 nominations.,"$32,500,000",USA,Wayne Wang,"Comedy, Drama, Family",English,20th Century Fox,PG,18 Feb 2005,106 min,Because of Winn-Dixie,2005.0,6.4,"9,071",13218723.0,14000000,96.0,88.0
tt0433400,"Ryan Reynolds, Amy Smart, Anna Faris, Chris Klein",3 nominations.,"$32,596,916","Germany, USA, Canada",Roger Kumble,"Comedy, Romance",English,New Line Cinema,PG-13,23 Nov 2005,96 min,Just Friends,2005.0,6.2,"91,261",9191331.0,,113.0,209.0
tt0382992,"Josh Lucas, Jessica Biel, Jamie Foxx, Sam Shepard",2 nominations.,"$31,704,416",USA,Rob Cohen,"Action, Adventure, Sci-Fi","English, Korean, Russian, Spanish",Columbia Pictures,PG-13,29 Jul 2005,121 min,Stealth,2005.0,5.0,"47,770",13251545.0,135000000,146.0,389.0
tt0397065,"Elisha Cuthbert, Chad Michael Murray, Brian Van Holt, Paris Hilton",5 wins & 11 nominations.,"$32,000,000","Australia, USA",Jaume Collet-Serra,"Horror, Mystery, Thriller",English,Warner Bros. Pictures,R,06 May 2005,108 min,House of Wax,2005.0,5.3,"102,260",12077236.0,30000000,228.0,582.0
tt0433383,"Jeff Daniels, David Strathairn, Alex Borstein, Rose Abdoo",Nominated for 6 Oscars. Another 38 wins & 121 nominations.,"$31,500,000","USA, France, UK, Japan",George Clooney,"Biography, Drama, History",English,Warner Independent Pictures,PG,04 Nov 2005,93 min,"Good Night, and Good Luck.",2005.0,7.5,"87,657",421446.0,7500000,354.0,530.0
tt0399146,"Viggo Mortensen, Maria Bello, Ed Harris, William Hurt",Nominated for 2 Oscars. Another 37 wins & 78 nominations.,"$31,500,000","USA, Germany, Canada",David Cronenberg,"Crime, Drama, Thriller",English,New Line Cinema,R,30 Sep 2005,96 min,A History of Violence,2005.0,7.5,"203,079",515992.0,32000000,440.0,1128.0
tt0430308,"50 Cent, Adewale Akinnuoye-Agbaje, Joy Bryant, Omar Benson Miller",6 wins & 3 nominations.,"$30,885,034","USA, Canada",Jim Sheridan,"Biography, Crime, Drama","English, Spanish",Paramount Pictures,R,09 Nov 2005,117 min,Get Rich or Die Tryin',2005.0,5.2,"39,438",12020807.0,40000000,96.0,288.0
tt0432291,"Tom Welling, Maggie Grace, Selma Blair, DeRay Davis",2 wins.,"$29,511,112",USA,Rupert Wainwright,Horror,English,Sony Pictures Classics,PG-13,14 Oct 2005,100 min,The Fog,2005.0,3.6,"31,395",11752917.0,18000000,142.0,456.0
tt0406375,"Jonah Bobo, Josh Hutcherson, Dax Shepard, Kristen Stewart",2 wins & 3 nominations.,"$28,045,540",USA,Jon Favreau,"Action, Adventure, Comedy",English,Sony Pictures,PG,11 Nov 2005,101 min,Zathura: A Space Adventure,2005.0,6.2,"78,656",13427872.0,65000000,136.0,212.0
